TEKS ID,Statement,Grade,Chapter
110.7.b.9.D,"recognize characteristics and structures of informational text, including:",,110
110.7.b.9.E,recognize characteristics and structures of argumentative text by:,,110
110.7.b.9.F,recognize characteristics of multimodal and digital texts.,,110
110.7.b.9.D.i,the central idea with supporting evidence;,,110
110.7.b.9.D.ii,"features such as insets, timelines, and sidebars to support understanding; and",,110
110.7.b.9.D.iii,organizational patterns such as logical order and order of importance;,,110
110.7.b.9.E.i,identifying the claim;,,110
110.7.b.9.E.ii,explaining how the author has used facts for or against an argument; and,,110
110.7.b.9.E.iii,identifying the intended audience or reader; and,,110
110.7.b.10.A,explain the author's purpose and message within a text;,,110
110.7.b.10.B,analyze how the use of text structure contributes to the author's purpose;,,110
110.7.b.10.C,analyze the author's use of print and graphic features to achieve specific purposes;,,110
110.7.b.10.D,"describe how the author's use of imagery, literal and figurative language such as simile and metaphor, and sound devices achieves specific purposes;",,110
110.7.b.10.E,"identify and understand the use of literary devices, including first- or third-person point of view;",,110
110.7.b.10.F,examine how the author's use of language contributes to voice; and,,110
110.7.b.10.G,"explain the purpose of hyperbole, stereotyping, and anecdote.",,110
110.7.b.11.A,"plan a first draft by selecting a genre for a particular topic, purpose, and audience using a range of strategies such as brainstorming, freewriting, and mapping;",,110
110.7.b.11.B,"develop drafts into a focused, structured, and coherent piece of writing by:",,110
110.7.b.11.C,"revise drafts to improve sentence structure and word choice by adding, deleting, combining, and rearranging ideas for coherence and clarity;",,110
110.7.b.11.D,"edit drafts using standard English conventions, including:",,110
110.7.b.11.E,publish written work for appropriate audiences.,,110
110.7.b.11.B.ii,developing an engaging idea reflecting depth of thought with specific facts and details;,,110
110.7.b.11.D.i,"complete simple and compound sentences with subject-verb agreement and avoidance of splices, run-ons, and fragments;",,110
110.7.b.11.D.ii,past tense of irregular verbs;,,110
110.7.b.11.D.iii,collective nouns;,,110
110.7.b.11.D.iv,"adjectives, including their comparative and superlative forms;",,110
110.7.b.11.D.v,conjunctive adverbs;,,110
110.7.b.11.D.vi,prepositions and prepositional phrases and their influence on subject-verb agreement;,,110
110.7.b.11.D.vii,"pronouns, including indefinite;",,110
110.7.b.11.D.viii,subordinating conjunctions to form complex sentences;,,110
110.7.b.11.D.ix,"capitalization of abbreviations, initials, acronyms, and organizations;",,110
110.7.b.11.D.x,"italics and underlining for titles and emphasis, and punctuation marks, including quotation marks in dialogue and commas in compound and complex sentences; and",,110
110.7.b.11.D.xi,correct spelling of words with grade-appropriate orthographic patterns and rules and high-frequency words; and,,110
110.7.b.12.A,"compose literary texts such as personal narratives, fiction, and poetry using genre characteristics and craft;",,110
110.7.b.12.B,"compose informational texts, including brief compositions that convey information about a topic, using a clear central idea and genre characteristics and craft;",,110
110.7.b.12.C,"compose argumentative texts, including opinion essays, using genre characteristics and craft; and",,110
110.7.b.12.D,compose correspondence that requests information.,,110
110.7.b.13.A,generate and clarify questions on a topic for formal and informal inquiry;,,110
110.7.b.13.B,develop and follow a research plan with adult assistance;,,110
110.7.b.13.C,identify and gather relevant information from a variety of sources;,,110
110.7.b.13.D,understand credibility of primary and secondary sources;,,110
110.7.b.13.E,demonstrate understanding of information gathered;,,110
110.7.b.13.F,differentiate between paraphrasing and plagiarism when using source materials;,,110
110.7.b.13.G,develop a bibliography; and,,110
110.7.b.13.H,"use an appropriate mode of delivery, whether written, oral, or multimodal, to present results.",,110
110.24.a.1,"The English language arts and reading Texas Essential Knowledge and Skills (TEKS) embody the interconnected nature of listening, speaking, reading, writing, and thinking through the seven integrated strands of developing and sustaining foundational language skills; comprehension; response; multiple genres; author's purpose and craft; composition; and inquiry and research. The strands focus on academic oracy (proficiency in oral expression and comprehension), authentic reading, and reflective writing to ensure a literate Texas. The strands are integrated and progressive with students continuing to develop knowledge and skills with increased complexity and nuance in order to think critically and adapt to the ever-evolving nature of language and literacy.",,110
110.24.a.2,"The seven strands of the essential knowledge and skills for English language arts and reading are intended to be integrated for instructional purposes and are recursive in nature. Strands include the four domains of language (listening, speaking, reading, writing) and their application in order to accelerate the acquisition of language skills so that students develop high levels of social and academic language proficiency. Although some strands may require more instructional time, each strand is of equal value, may be presented in any order, and should be integrated throughout the year. Additionally, students should engage in academic conversations, write, read, and be read to on a daily basis with opportunities for cross-curricular content and student choice.",,110
110.24.a.3,"Text complexity increases with challenging vocabulary, sophisticated sentence structures, nuanced text features, cognitively demanding content, and subtle relationships among ideas (Texas Education Agency, <i>STAAR Performance Level Descriptors</i>, 2013). As skills and knowledge are obtained in each of the seven strands, students will continue to apply earlier standards with greater depth to increasingly complex texts in multiple genres as they become self-directed, critical learners who work collaboratively while continuously using metacognitive skills.",,110
110.24.a.4,"English language learners (ELLs) are expected to meet standards in a second language; however, their proficiency in English influences the ability to meet these standards. To demonstrate this knowledge throughout the stages of English language acquisition, comprehension of text requires additional scaffolds such as adapted text, translations, native language support, cognates, summaries, pictures, realia, glossaries, bilingual dictionaries, thesauri, and other modes of comprehensible input. ELLs can and should be encouraged to use knowledge of their first language to enhance vocabulary development; vocabulary needs to be in the context of connected discourse so that it is meaningful. Strategic use of the student's first language is important to ensure linguistic, affective, cognitive, and academic development in English.",,110
110.24.a.6,"Oral language proficiency holds a pivotal role in school success; verbal engagement must be maximized across grade levels (Kinsella, 2010). In order for students to become thinkers and proficient speakers in science, social studies, mathematics, fine arts, language arts and reading, and career and technical education, they must have multiple opportunities to practice and apply the academic language of each discipline (Fisher, Frey, & Rothenberg, 2008).",,110
110.24.a.7,"Statements that contain the word ""including"" reference content that must be mastered, while those containing the phrase ""such as"" are intended as possible illustrative examples.",,110
110.24.b.1,"Developing and sustaining foundational language skills: listening, speaking, discussion, and thinking--oral language. The student develops oral language through listening, speaking, and discussion. The student is expected to:",,110
110.24.b.2,"Developing and sustaining foundational language skills: listening, speaking, reading, writing, and thinking--vocabulary. The student uses newly acquired vocabulary expressively. The student is expected to:",,110
110.24.b.3,"Developing and sustaining foundational language skills: listening, speaking, reading, writing, and thinking--fluency. The student reads grade-level text with fluency and comprehension. The student is expected to adjust fluency when reading grade-level text based on the reading purpose.",,110
110.24.b.4,"Developing and sustaining foundational language skills: listening, speaking, reading, writing, and thinking--self-sustained reading. The student reads grade-appropriate texts independently. The student is expected to self-select text and read independently for a sustained period of time.",,110
110.24.b.5,"Comprehension skills: listening, speaking, reading, writing, and thinking using multiple texts. The student uses metacognitive skills to both develop and deepen comprehension of increasingly complex texts. The student is expected to:",,110
110.24.b.6,"Response skills: listening, speaking, reading, writing, and thinking using multiple texts. The student responds to an increasingly challenging variety of sources that are read, heard, or viewed. The student is expected to:",,110
110.24.b.7,"Multiple genres: listening, speaking, reading, writing, and thinking using multiple texts--literary elements. The student recognizes and analyzes literary elements within and across increasingly complex traditional, contemporary, classical, and diverse literary texts. The student is expected to:",,110
110.24.b.8,"Multiple genres: listening, speaking, reading, writing, and thinking using multiple texts--genres. The student recognizes and analyzes genre-specific characteristics, structures, and purposes within and across increasingly complex traditional, contemporary, classical, and diverse texts. The student is expected to:",,110
110.24.b.9,"Author's purpose and craft: listening, speaking, reading, writing, and thinking using multiple texts. The student uses critical inquiry to analyze the authors' choices and how they influence and communicate meaning within a variety of texts. The student analyzes and applies author's craft purposefully in order to develop his or her own products and performances. The student is expected to:",,110
110.24.b.10,"Composition: listening, speaking, reading, writing, and thinking using multiple texts--writing process. The student uses the writing process recursively to compose multiple texts that are legible and uses appropriate conventions. The student is expected to:",,110
110.24.b.11,"Composition: listening, speaking, reading, writing, and thinking using multiple texts--genres. The student uses genre characteristics and craft to compose multiple texts that are meaningful. The student is expected to:",,110
110.24.b.12,"Inquiry and research: listening, speaking, reading, writing, and thinking using multiple texts. The student engages in both short-term and sustained recursive inquiry processes for a variety of purposes. The student is expected to:",,110
110.24.b.1.A,"listen actively to interpret a message by summarizing, asking questions, and making comments;",,110
110.24.b.1.B,"follow and give complex oral instructions to perform specific tasks, answer questions, or solve problems;",,110
110.24.b.1.C,"advocate a position using anecdotes, analogies, and/or illustrations employing eye contact, speaking rate, volume, enunciation, a variety of natural gestures, and conventions of language to communicate ideas effectively; and",,110
110.24.b.1.D,"participate collaboratively in discussions, plan agendas with clear goals and deadlines, set time limits for speakers, take notes, and vote on key issues.",,110
110.24.b.2.A,"use print or digital resources to determine the meaning, syllabication, pronunciation, word origin, and part of speech;",,110
110.24.b.2.B,use context within or beyond a paragraph to clarify the meaning of unfamiliar or ambiguous words; and,,110
110.24.b.2.C,"determine the meaning and usage of grade-level academic English words derived from Greek and Latin roots such as ast, qui, path, mand/mend, and duc.",,110
110.24.b.5.A,establish purpose for reading assigned and self-selected texts;,,110
110.24.b.5.B,"generate questions about text before, during, and after reading to deepen understanding and gain information;",,110
110.24.b.5.C,"make and correct or confirm predictions using text features, characteristics of genre, and structures;",,110
110.24.b.5.D,create mental images to deepen understanding;,,110
110.24.b.5.E,"make connections to personal experiences, ideas in other texts, and society;",,110
110.24.b.5.F,make inferences and use evidence to support understanding;,,110
110.24.b.5.G,evaluate details read to determine key ideas;,,110
110.24.b.5.H,synthesize information to create new understanding; and,,110
110.24.b.5.I,"monitor comprehension and make adjustments such as re-reading, using background knowledge, asking questions, and annotating when understanding breaks down.",,110
110.24.b.6.A,"describe personal connections to a variety of sources, including self-selected texts;",,110
110.24.b.6.B,"write responses that demonstrate understanding of texts, including comparing sources within and across genres;",,110
110.24.b.6.C,use text evidence to support an appropriate response;,,110
110.24.b.6.D,paraphrase and summarize texts in ways that maintain meaning and logical order;,,110
110.24.b.6.E,"interact with sources in meaningful ways such as notetaking, annotating, freewriting, or illustrating;",,110
110.24.b.6.F,respond using newly acquired vocabulary as appropriate;,,110
110.24.b.6.G,discuss and write about the explicit or implicit meanings of text;,,110
110.24.b.6.H,"respond orally or in writing with appropriate register, vocabulary, tone, and voice;",,110
110.24.b.6.I,reflect on and adjust responses as new evidence is presented; and,,110
110.24.b.6.J,defend or challenge the authors' claims using relevant text evidence.,,110
110.24.b.7.A,analyze how themes are developed through the interaction of characters and events;,,110
110.24.b.7.B,analyze how characters' motivations and behaviors influence events and resolution of the conflict;,,110
110.24.b.7.C,"analyze non-linear plot development such as flashbacks, foreshadowing, subplots, and parallel plot structures and compare it to linear plot development; and",,110
110.24.b.7.D,explain how the setting influences the values and beliefs of characters.,,110
110.24.b.8.A,"demonstrate knowledge of literary genres such as realistic fiction, adventure stories, historical fiction, mysteries, humor, fantasy, science fiction, and short stories;",,110
110.24.b.8.B,"analyze the effect of graphical elements such as punctuation and line length in poems across a variety of poetic forms such as epic, lyric, and humorous poetry;",,110
110.24.b.8.C,analyze how playwrights develop dramatic action through the use of acts and scenes;,,110
110.24.b.8.D,"analyze characteristics and structural elements of informational text, including:",,110
110.24.b.8.E,analyze characteristics and structures of argumentative text by:,,110
110.24.b.8.F,analyze characteristics of multimodal and digital texts.,,110
110.24.b.8.D.i,the controlling idea or thesis with supporting evidence;,,110
110.24.b.8.D.ii,"features such as footnotes, endnotes, and citations; and",,110
110.24.b.8.D.iii,multiple organizational patterns within a text to develop the thesis;,,110
110.24.b.8.E.i,identifying the claim and analyzing the argument;,,110
110.24.b.8.E.ii,identifying and explaining the counter argument; and,,110
110.24.b.8.E.iii,identifying the intended audience or reader; and,,110
110.24.b.9.A,explain the author's purpose and message within a text;,,110
110.24.b.9.B,analyze how the use of text structure contributes to the author's purpose;,,110
110.24.b.9.C,analyze the author's use of print and graphic features to achieve specific purposes;,,110
110.24.b.9.D,describe how the author's use of figurative language such as extended metaphor achieves specific purposes;,,110
110.24.b.9.E,"identify and analyze the use of literary devices, including multiple points of view and irony;",,110
110.24.b.9.F,"analyze how the author's use of language contributes to the mood, voice, and tone; and",,110
110.24.b.9.G,explain the purpose of rhetorical devices such as analogy and juxtaposition and of logical fallacies such as bandwagon appeals and circular reasoning.,,110
110.24.b.10.A,"plan a first draft by selecting a genre appropriate for a particular topic, purpose, and audience using a range of strategies such as discussion, background reading, and personal interests;",,110
110.24.b.10.B,"develop drafts into a focused, structured, and coherent piece of writing by:",,110
110.24.b.10.C,"revise drafts for clarity, development, organization, style, word choice, and sentence variety;",,110
110.24.b.10.D,"edit drafts using standard English conventions, including:",,110
110.24.b.10.E,publish written work for appropriate audiences.,,110
110.24.b.10.B.ii,"developing an engaging idea reflecting depth of thought with specific facts, details, and examples;",,110
110.24.b.10.D.i,"complete complex sentences with subject-verb agreement and avoidance of splices, run-ons, and fragments;",,110
110.24.b.10.D.ii,"consistent, appropriate use of verb tenses and active and passive voice;",,110
110.24.b.10.D.iii,prepositions and prepositional phrases and their influence on subject-verb agreement;,,110
110.24.b.10.D.iv,pronoun-antecedent agreement;,,110
110.24.b.10.D.v,correct capitalization;,,110
110.24.b.10.D.vi,"punctuation, including commas in nonrestrictive phrases and clauses, semicolons, colons, and parentheses; and",,110
110.24.b.10.D.vii,"correct spelling, including commonly confused terms such as its/it's, affect/effect, there/their/they're, and to/two/too; and",,110
110.24.b.11.A,"compose literary texts such as personal narratives, fiction, and poetry using genre characteristics and craft;",,110
110.24.b.11.B,"compose informational texts, including multi-paragraph essays that convey information about a topic, using a clear controlling idea or thesis statement and genre characteristics and craft;",,110
110.24.b.11.C,compose multi-paragraph argumentative texts using genre characteristics and craft; and,,110
110.24.b.11.D,"compose correspondence that reflects an opinion, registers a complaint, or requests information in a business or friendly structure.",,110
110.24.b.12.A,generate student-selected and teacher-guided questions for formal and informal inquiry;,,110
110.24.b.12.B,develop and revise a plan;,,110
110.24.b.12.C,"refine the major research question, if necessary, guided by the answers to a secondary set of questions;",,110
110.24.b.12.D,identify and gather relevant information from a variety of sources;,,110
110.24.b.12.E,differentiate between primary and secondary sources;,,110
110.24.b.12.F,synthesize information from a variety of sources;,,110
110.24.b.12.G,differentiate between paraphrasing and plagiarism when using source materials;,,110
110.24.b.12.H,examine sources for:,,110
110.24.b.12.I,display academic citations and use source materials ethically; and,,110
110.24.b.12.J,"use an appropriate mode of delivery, whether written, oral, or multimodal, to present results.",,110
110.24.b.12.H.i,"reliability, credibility, and bias, including omission; and",,110
110.24.b.12.H.ii,"faulty reasoning such as bandwagon appeals, repetition, and loaded language;",,110
110.25.a.1,"Reading offers students an opportunity to read with competence, confidence, and understanding through instruction in comprehension strategies, word recognition, and vocabulary. Middle school students read, write, listen, speak, and view to learn more about the world around them and to create, clarify, critique, and appreciate ideas and responses. Middle school students complete research projects or locate answers to questions using multiple texts and resources. In addition, middle school students continue to read on their own or listen to texts read aloud for the purpose of enjoyment. Middle school students read both printed texts and electronic media independently, bringing with them various strategies to aid in comprehension. Significant blocks of time are provided for reading both independent and instructional-level material for varied purposes such as collecting information, learning about and appreciating the writer's craft, and discovering models for their own writing. Middle school students respond to texts through various avenues such as talk, print and electronic formats, connecting their knowledge of the world with the text being read. For middle school students whose first language is not English, the students' native language serves as a foundation for English language acquisition and language learning.",,110
110.25.a.2,"The essential knowledge and skills as well as the student expectations for Reading, an elective course, are described in subsection (b) of this section.",,110
110.25.b.1,The student uses a variety of word recognition strategies. The student is expected to:,,110
110.25.b.2,The student acquires vocabulary through reading and systematic word study. The student is expected to:,,110
110.25.b.3,The student reads with fluency and understanding in increasingly demanding texts. The student is expected to:,,110
110.25.b.4,The student comprehends selections using a variety of strategies. The student is expected to:,,110
110.25.b.5,The student reads texts to find information on self-selected and assigned topics. The student is expected to:,,110
110.25.b.6,"The student reads for different purposes in varied sources, both narrative and expository. The student is expected to:",,110
110.25.b.7,The student formulates and supports responses to various types of texts. The student is expected to:,,110
110.25.b.8,The student reads critically to evaluate texts in order to determine the credibility of sources. The student is expected to:,,110
110.25.b.9,"The student reads to increase knowledge of own culture, the culture of others, and the common elements of cultures. The student is expected to:",,110
110.25.b.1.A,"apply knowledge of letter-sound correspondences, language structure, and context to recognize words; and",,110
110.25.b.1.B,"use dictionaries, glossaries, and other sources to confirm pronunciations and meanings of unfamiliar words.",,110
110.25.b.2.A,"expand vocabulary by reading, viewing, listening, and discussing;",,110
110.25.b.2.B,determine word meaning by using context;,,110
110.25.b.2.C,"use spelling, prefixes and suffixes, roots, and word origins to understand meanings;",,110
110.25.b.2.D,"use reference aids such as a glossary, dictionary, thesaurus, and available technology to determine meanings and pronunciations; and",,110
110.25.b.2.E,"identify analogies, homonyms, synonyms/antonyms, and connotation/denotation.",,110
110.25.b.3.A,read silently for a variety of purposes with comprehension for sustained periods of time;,,110
110.25.b.3.B,adjust reading rate based on purposes for reading; and,,110
110.25.b.3.C,read orally at a rate that enables comprehension.,,110
110.25.b.4.A,use prior knowledge and experience to comprehend;,,110
110.25.b.4.B,determine purpose for reading;,,110
110.25.b.4.C,"self-monitor reading and adjust when confusion occurs by rereading, using resources, and questioning;",,110
110.25.b.4.D,summarize texts by identifying main ideas and relevant details;,,110
110.25.b.4.E,"make inferences such as drawing conclusions and making generalizations or predictions, supporting them with prior experiences and textual evidence;",,110
110.25.b.4.F,"analyze and use both narrative and expository text structures: sequence, description, problem/solution, compare/contrast, and cause/effect;",,110
110.25.b.4.G,"make connections and find patterns, similarities, and differences across texts;",,110
110.25.b.4.H,construct visual images based on text descriptions;,,110
110.25.b.4.I,determine important ideas from texts and oral presentations;,,110
110.25.b.4.J,"manage text by using practices such as previewing, highlighting, making marginal notes, notetaking, outlining, and journaling; and",,110
110.25.b.4.K,"use questioning to enhance comprehension before, during, and after reading.",,110
110.25.b.5.A,"generate relevant, interesting, and researchable questions;",,110
110.25.b.5.B,locate appropriate print and non-print information using text and technical resources;,,110
110.25.b.5.C,"organize and record new information in systematic ways to develop notes, charts, and graphic organizers;",,110
110.25.b.5.D,communicate information gained from reading;,,110
110.25.b.5.E,use compiled information and knowledge to raise additional unanswered questions; and,,110
110.25.b.5.F,"use text organizers such as overviews, headings, and graphic features to locate and categorize information.",,110
110.25.b.6.A,"read to enjoy, to complete a task, to gather information, to be informed, to solve problems, to answer questions, to analyze, to interpret, and to evaluate;",,110
110.25.b.6.B,"read sources such as literature, diaries, journals, textbooks, maps, newspapers, letters, speeches, memoranda, electronic texts, and technical documents; and",,110
110.25.b.6.C,understand and interpret visual representations.,,110
110.25.b.7.A,respond actively to texts in both aesthetic and critical ways;,,110
110.25.b.7.B,"respond to text through discussion, journal writing, performance, and visual representation; and",,110
