TEKS ID,Statement,Grade,Chapter
110.57.b.1.F,apply knowledge and understanding of rhetoric to analyze and evaluate oral or written speeches.,,110
110.57.b.2.B,identify and analyze logical patterns of organization for specific speech forms;,,110
110.57.b.2.C,identify and analyze the characteristics of a speech to inform;,,110
110.57.b.2.D,"identify and analyze the characteristics of a speech to persuade, including propositions of fact, value, problem, and/or policy;",,110
110.57.b.2.E,identify and analyze characteristics of speeches for special occasions; and,,110
110.57.b.2.F,"analyze and evaluate the rhetorical elements in models of speeches that inform, persuade, or inspire.",,110
110.57.b.3.A,identify and analyze the audience and occasion as a basis for choosing speech strategies;,,110
110.57.b.3.B,"select and limit topics for speeches considering his/her own interests, timeliness, and the importance of the topic;",,110
110.57.b.3.C,select and limit purposes for speeches;,,110
110.57.b.3.D,"research topics using primary and secondary sources, including electronic technology; and",,110
110.57.b.3.E,"analyze oral and written speech models to evaluate the topic, purpose, audience, and occasion.",,110
110.57.b.4.A,apply knowledge of speech form to organize and design speeches;,,110
110.57.b.4.B,"organize speeches effectively for specific topics, purposes, audiences, and occasions;",,110
110.57.b.4.C,choose logical patterns of organization for bodies of speech;,,110
110.57.b.4.D,prepare outlines reflecting logical organization; and,,110
110.57.b.4.E,analyze and evaluate the organization of oral or written speech models.,,110
110.57.b.5.A,"analyze the implications of the audience, occasion, topic, and purpose as a basis for choosing proofs and appeals for speeches;",,110
110.57.b.5.B,choose logical proofs and appeals that meet standard tests of evidence;,,110
110.57.b.5.C,"use logical, ethical, and emotional proofs and appeals to support and clarify claims in speeches;",,110
110.57.b.5.D,"choose proofs and appeals that enhance a specific topic, purpose, and tone;",,110
110.57.b.5.F,choose or produce effective visual supports; and,,110
110.57.b.5.G,analyze and evaluate the proofs and appeals used in oral or written speech models.,,110
110.57.b.6.A,distinguish between oral and written language styles;,,110
110.57.b.6.B,write manuscripts to facilitate language choices and enhance oral style;,,110
110.57.b.6.C,"use rhetorical and stylistic devices to achieve clarity, force, and aesthetic effect;",,110
110.57.b.6.D,"use informal, standard, and technical language appropriately;",,110
110.57.b.6.E,"employ previews, transitions, summaries, signposts, and other appropriate rhetorical strategies to enhance clarity; and",,110
110.57.b.6.F,evaluate a speaker's style in oral or written speech models.,,110
110.57.b.7.A,"employ techniques and strategies to reduce communication apprehension, develop self-confidence, and facilitate command of information and ideas;",,110
110.57.b.7.B,rehearse and employ a variety of delivery strategies;,,110
110.57.b.7.C,"develop verbal, vocal, and physical skills to enhance presentations;",,110
110.57.b.7.D,"use notes, manuscripts, rostrum, visual aids, and/or electronic devices; and",,110
110.57.b.7.E,interact with audiences appropriately.,,110
110.57.b.8.A,"use critical, deliberative, and appreciative listening skills to evaluate speeches; and",,110
110.57.b.8.B,critique speeches using knowledge of rhetorical principles.,,110
110.58.a.1,"Understanding and developing skills in communication are fundamental to all other learning and to all levels of human interaction. For successful participation in professional and social life, students must develop effective communication skills. Rapidly expanding technologies and changing social and corporate systems demand that students send clear verbal messages, choose effective nonverbal behaviors, listen for desired results, and apply valid critical-thinking and problem-solving processes. Students enrolled in Communication Applications will be expected to identify, analyze, develop, and evaluate communication skills needed for professional and social success in interpersonal situations, group interactions, and personal and professional presentations.",,110
110.58.a.2,"For high school students whose first language is not English, the students' native language serves as a foundation for English language acquisition and language learning.",,110
110.58.a.3,"Statements that contain the word ""including"" reference content that must be mastered, while those containing the phrase ""such as"" are intended as possible illustrative examples.",,110
110.58.a.4,The essential knowledge and skills as well as the student expectations for Communication Applications are described in subsection (b) of this section.,,110
110.58.b.1,Communication process. The student demonstrates knowledge of various communication processes in professional and social contexts. The student is expected to:,,110
110.58.b.2,Interpersonal. The student uses appropriate interpersonal communication strategies in professional and social contexts. The student is expected to:,,110
110.58.b.3,Group communication. The student communicates effectively in groups in professional and social contexts. The student is expected to:,,110
110.58.b.4,Presentations. The student makes and evaluates formal and informal professional presentations. The student is expected to:,,110
110.58.b.1.A,explain the importance of effective communication skills in professional and social contexts;,,110
110.58.b.1.B,identify the components of the communication process and their functions;,,110
110.58.b.1.C,"identify standards for making appropriate communication choices for self, listener, occasion, and task;",,110
110.58.b.1.D,"identify the characteristics of oral language and analyze standards for using informal, standard, and technical language appropriately;",,110
110.58.b.1.E,identify types of nonverbal communication and their effects;,,110
110.58.b.1.F,"recognize the importance of effective nonverbal strategies such as appearance, a firm handshake, direct eye contact, and appropriate use of space and distance;",,110
110.58.b.1.G,identify the components of the listening process;,,110
110.58.b.1.H,"identify specific kinds of listening such as critical, deliberative, and empathic;",,110
110.58.b.1.I,recognize the importance of gathering and using accurate and complete information as a basis for making communication decisions;,,110
110.58.b.1.J,identify and analyze ethical and social responsibilities of communicators; and,,110
110.58.b.1.K,recognize and analyze appropriate channels of communication in organizations.,,110
110.58.b.2.A,"identify types of professional and social relationships, their importance, and the purposes they serve;",,110
110.58.b.2.B,"employ appropriate verbal, nonverbal, and listening skills to enhance interpersonal relationships;",,110
110.58.b.2.C,"use communication management skills to develop appropriate assertiveness, tact, and courtesy;",,110
110.58.b.2.E,"send clear and appropriate requests, provide clear and accurate directions, ask appropriate and purposeful questions, and respond appropriately to the requests, directions, and questions of others;",,110
110.58.b.2.F,participate appropriately in conversations;,,110
110.58.b.2.G,communicate effectively in interviews;,,110
110.58.b.2.H,"identify and use appropriate strategies for dealing with differences, including gender, ethnicity, and age; and",,110
110.58.b.2.I,analyze and evaluate the effectiveness of one's own and others' communication.,,110
110.58.b.3.A,"identify kinds of groups, their importance, and the purposes they serve;",,110
110.58.b.3.B,analyze group dynamics and processes for participating effectively in groups;,,110
110.58.b.3.C,identify and analyze the roles of group members and their influence on group dynamics;,,110
110.58.b.3.D,demonstrate understanding of group roles and their impact on group effectiveness;,,110
110.58.b.3.E,"use appropriate verbal, nonverbal, and listening skills to promote group effectiveness;",,110
110.58.b.3.F,identify and analyze leadership styles;,,110
110.58.b.3.G,use effective communication strategies in leadership roles;,,110
110.58.b.3.H,"use effective communication strategies for solving problems, managing conflicts, and building consensus in groups; and",,110
110.58.b.3.I,analyze the participation and contributions of group members and evaluate group effectiveness.,,110
110.58.b.4.A,"analyze the audience, occasion, and purpose when designing presentations;",,110
110.58.b.4.B,determine specific topics and purposes for presentations;,,110
110.58.b.4.C,"research topics using primary and secondary sources, including electronic technology;",,110
110.58.b.4.D,use effective strategies to organize and outline presentations;,,110
110.58.b.4.E,use information effectively to support and clarify points in presentations;,,110
110.58.b.4.F,prepare scripts or notes for presentations;,,110
110.58.b.4.G,"prepare and use visual or auditory aids, including technology, to enhance presentations;",,110
110.58.b.4.H,"use appropriate techniques to manage communication apprehension, build self-confidence, and gain command of the information;",,110
110.58.b.4.I,use effective verbal and nonverbal strategies in presentations;,,110
110.58.b.4.J,"make group presentations to inform, persuade, or motivate an audience;",,110
110.58.b.4.K,"make individual presentations to inform, persuade, or motivate an audience;",,110
110.58.b.4.L,participate in question-and-answer sessions following presentations;,,110
110.58.b.4.M,apply critical-listening strategies to evaluate presentations; and,,110
110.58.b.4.N,evaluate effectiveness of his/her own presentation.,,110
110.59.a.1,"Literature and its presentation are integral to understanding the cultural aspects of a society. Students in Oral Interpretation I, II, III will select, research, analyze, adapt, interpret, and perform literary texts as a communication art. Students focus on intellectual, emotional, sensory, and aesthetic levels of texts to attempt to capture the entirety of the author's work. Individual or group performances of literature will be presented and evaluated.",,110
110.59.a.2,"For high school students whose first language is not English, the students' native language serves as a foundation for English language acquisition and language learning.",,110
110.59.a.3,"Statements that contain the word ""including"" reference content that must be mastered, while those containing the phrase ""such as"" are intended as possible illustrative examples.",,110
110.59.a.4,"The essential knowledge and skills as well as the student expectations for Oral Interpretation I, II, III, elective courses, are described in subsection (b) of this section.",,110
110.59.b.1,Definition and theory. The student recognizes oral interpretation as a communication art. The student is expected to:,,110
110.59.b.2,Selection. The student selects literature for performance. The student is expected to:,,110
110.59.b.3,Research. The student uses relevant research to promote understanding of literary works. The student is expected to:,,110
110.59.b.4,"Analysis. The student analyzes the chosen text to assess its implications for adaptation, interpretation, and performance. The student is expected to:",,110
110.59.b.5,Adaptation. The student adapts written text for individual or group performance based on appropriate research and analysis. The student is expected to:,,110
110.59.b.6,Interpretation. The student applies research and analysis to make appropriate performance choices. The student is expected to:,,110
110.59.b.7,Rehearsal and performance. The student uses insights gained from research and analysis to rehearse and perform literature for a variety of audiences and occasions. The student is expected to:,,110
110.59.b.8,Evaluation. The student uses critical and appreciative listening to evaluate individual and group performances. The student is expected to:,,110
110.59.b.1.A,explain definitions and theories of oral interpretation as a communication art;,,110
110.59.b.1.B,"analyze the role of the interpreter and the ethical responsibilities to the author, the literary text, and the audience; and",,110
110.59.b.1.C,develop and use a workable theory of interpretation as a basis for performance choices.,,110
110.59.b.2.A,"select literature appropriate for the reader, the audience, and the occasion;",,110
110.59.b.2.B,apply standards of literary merit when selecting literature for individual or group performance;,,110
110.59.b.2.C,choose literature that can be appropriately adapted; and,,110
110.59.b.2.D,select performance materials from a variety of literary genre.,,110
110.59.b.3.A,"read the text to grasp the author's meaning, theme, tone, and purpose; and",,110
110.59.b.3.B,"research the author, author's works, literary criticism, allusions in the text, and definitions and pronunciations of words to enhance understanding and appreciation of the chosen text.",,110
110.59.b.4.A,identify and analyze the literary form or genre;,,110
110.59.b.4.B,identify and analyze structural elements in the chosen text;,,110
110.59.b.4.C,identify and analyze the narrative voice and/or other speakers such as personae in the literature;,,110
110.59.b.4.D,"identify and analyze the time, place, and atmosphere;",,110
110.59.b.4.E,"analyze the shifts or transitions in speaker, time, and place to determine who is speaking, to whom they are speaking, where they are speaking, when they are speaking, and for what reason they are speaking;",,110
110.59.b.4.F,"analyze individual units such as paragraphs, verses, sentences, and lines for meaning and specificity;",,110
110.59.b.4.G,"identify descriptive phrases, figures of speech, stylistic devices, and word choices to analyze the imagery in the text;",,110
110.59.b.4.H,trace the emotional progression of the text; and,,110
110.59.b.4.I,"recognize literal and symbolic meanings, universal themes, or unique aspects of the text.",,110
110.59.b.5.A,"maintain ethical responsibility to author, text, and audience when adapting literature;",,110
110.59.b.5.B,apply appropriate criteria for lifting scenes and cutting literary selections;,,110
110.59.b.5.C,"use effective strategies for planning and organizing programs focused on a specific theme, author, or central comment; and",,110
110.59.b.6.A,justify the use or nonuse of manuscript or other aids;,,110
110.59.b.6.B,"justify strategies for the use of focus, gesture, and movement;",,110
110.59.b.6.C,"justify the use of vocal strategies such as rate, pitch, inflection, volume, and pause;",,110
110.59.b.6.D,"justify the use of dialect, pronunciation, enunciation, or articulation; and",,110
110.59.b.6.E,"use research, analysis, personal experiences, and responses to the literature to justify performance choices.",,110
110.59.b.7.A,use effective rehearsal strategies to promote internalization and visualization of the text;,,110
110.59.b.7.B,use appropriate rehearsal strategies to develop confidence and enhance effective communication of the text to an audience in individual and group performance;,,110
110.59.b.7.C,participate in effective group decision-making processes to prepare and present group performances; and,,110
110.59.b.7.D,present individual and group performances.,,110
110.59.b.8.A,listen critically and appreciatively and respond appropriately to the performances of others;,,110
110.59.b.8.B,analyze and evaluate various performance styles;,,110
110.59.b.8.C,use a variety of techniques to evaluate and critique one's own and others' performances; and,,110
110.59.b.8.D,set goals for future performances based on evaluation.,,110
110.60.a.1,"Controversial issues arise in aspects of personal, social public, and professional life in modern society. Debate and argumentation are widely used to make decisions and reduce conflict. Students who develop skills in argumentation and debate become interested in current issues, develop sound critical thinking, and sharpen communication skills. They acquire life-long skills for intelligently approaching controversial issues.",,110
110.60.a.2,"For high school students whose first language is not English, the students' native language serves as a foundation for English language acquisition and language learning.",,110
110.60.a.3,"Statements that contain the word ""including"" reference content that must be mastered, while those containing the phrase ""such as"" are intended as possible illustrative examples.",,110
110.60.a.4,"The essential knowledge and skills as well as the student expectations for Debate I, II, III, elective courses, are described in subsection (b) of this section.",,110
110.60.b.1,Role in society. The student examines the historical and contemporary contributions of debate in decision-making and democratic processes. The student is expected to:,,110
110.60.b.2,Analysis of issues. The student analyzes controversial issues. The student is expected to:,,110
110.60.b.3,Propositions of value. The student develops and demonstrates skills for debating propositions of value. The student is expected to:,,110
110.60.b.4,Propositions of policy. The student develops and demonstrates skills for debating propositions of policy. The student is expected to:,,110
110.60.b.5,"Logic. The student applies critical thinking, logic, and reasoning in debate. The student is expected to:",,110
110.60.b.6,Proof. The student utilizes research and proof in debate. The student is expected to:,,110
110.60.b.7,Case construction. The student identifies and applies the basic concepts of debate case construction. The student is expected to:,,110
110.60.b.8,Refutation. The student identifies and applies the basic concepts of argumentation and refutation. The student is expected to:,,110
110.60.b.9,Delivery. The student uses effective communication skills in debating. The student is expected to:,,110
110.60.b.10,Evaluation. The student evaluates and critiques debates. The student is expected to:,,110
110.60.b.1.A,"identify the historical and contemporary use of debate in social, political, and religious arenas;",,110
110.60.b.1.B,"examine the role of the forensic progression of discussion, persuasion, and debate in dealing with controversial issues; and",,110
110.60.b.1.C,"recognize the role of argumentation and debate as an effective means of analyzing issues, discovering truth, finding solutions to problems, and understanding opposing viewpoints.",,110
110.60.b.2.A,"use appropriate standards to analyze and interpret propositions of fact, value, problem, and policy;",,110
110.60.b.2.B,accurately phrase and define debatable propositions;,,110
110.60.b.2.C,analyze and evaluate propositions and related issues presented in academic and public settings; and,,110
110.60.b.2.D,"recognize, analyze, and use various debate formats to support propositions.",,110
110.60.b.3.A,explain the concept of a value as it applies to a debate;,,110
110.60.b.3.B,analyze the role of value assumptions in formulating and evaluating argument;,,110
110.60.b.3.C,analyze the works of classical and contemporary philosophers;,,110
110.60.b.3.D,apply various standards for evaluating propositions of value;,,110
110.60.b.3.E,apply value assumptions and/or classical and contemporary philosophies appropriately in formulating arguments;,,110
110.60.b.3.F,develop and use valid approaches to construct affirmative and negative cases;,,110
110.60.b.3.G,use valid proofs appropriately to support claims in propositions of value;,,110
110.60.b.3.H,construct briefs for value propositions; and,,110
110.60.b.3.I,apply voting criteria to value propositions.,,110
110.60.b.4.A,evaluate implications of stock issues in affirmative and negative case construction and refutation;,,110
110.60.b.4.B,use and evaluate a variety of valid strategies to construct affirmative and negative cases;,,110
110.60.b.4.C,construct debate briefs for policy propositions; and,,110
110.60.b.4.D,analyze and adapt approaches to accommodate a variety of judging paradigms.,,110
110.60.b.5.A,"analyze and create arguments using various forms of logic such as inductive and deductive reasoning, syllogisms, traditional models of logic, and cause-effect;",,110
110.60.b.5.B,identify fallacies in reasoning and apply standards of validity and relevancy in analyzing and constructing argument; and,,110
110.60.b.5.C,"analyze the role of value assumptions in personal, social, and political conflicts.",,110
110.60.b.6.A,locate and use a variety of reliable technological and print sources;,,110
110.60.b.6.B,identify and apply standard tests of evidence for choosing appropriate logical proofs;,,110
110.60.b.6.C,demonstrate skill in recording and organizing information; and,,110
110.60.b.6.D,utilize ethical guidelines for debate research and use of evidence.,,110
110.60.b.7.A,identify the roles and responsibilities of the affirmative and negative positions;,,110
110.60.b.7.B,explain and apply the distinctive approaches to prima facie case construction; and,,110
110.60.b.7.C,use a variety of approaches to construct logical affirmative and negative cases.,,110
110.60.b.8.A,listen critically to formulate responses;,,110
110.60.b.8.B,take accurate notes during argumentation such as flow a debate;,,110
110.60.b.8.C,analyze and apply a variety of approaches for refuting and defending arguments;,,110
110.60.b.8.D,recognize and use effective cross-examination strategies; and,,110
110.60.b.8.E,extend cross-examination responses into refutation.,,110
110.60.b.9.A,use precise language and effective verbal skills in argumentation and debate;,,110
110.60.b.9.B,use effective nonverbal communication in argumentation and debate;,,110
110.60.b.9.C,use effective critical-listening strategies in argumentation and debate;,,110
110.60.b.9.D,demonstrate ethical behavior and courtesy during debate; and,,110
110.60.b.9.E,develop extemporaneous speaking skills.,,110
110.60.b.10.A,use a knowledge of debate principles to develop and apply evaluation standards for various debate formats; and,,110
110.60.b.10.B,provide valid and constructive written and/or oral critiques of debates.,,110
110.61.a.1,"Communication skills are important in all aspects of life. Students who have mastered concepts and developed skills in introductory courses should be provided with opportunities to extend their knowledge and expand their skills in more advanced study. Independent Study in Speech provides opportunities for advanced students to plan, organize, produce, perform, and evaluate a project that enables them to develop advanced skills in communication, critical thinking, and problem solving.",,110
110.61.a.2,"For high school students whose first language is not English, the students' native language serves as a foundation for English language acquisition and language learning.",,110
110.61.a.3,"Statements that contain the word ""including"" reference content that must be mastered, while those containing the phrase ""such as"" are intended as possible illustrative examples.",,110
110.61.a.4,"The essential knowledge and skills as well as the student expectations for Independent Study in Speech, an elective course, are described in subsection (b) of this section.",,110
110.61.b.1,Propose. The student plans and designs an independent study project. The student is expected to:,,110
110.61.b.2,Research. The student conducts research to support and develop the approved project. The student is expected to:,,110
110.61.b.3,Produce. The student produces the final product for the project. The student is expected to:,,110
110.61.b.4,Rehearse and present. The student presents the final product. The student is expected to:,,110
110.61.b.5,Evaluate. The student and designated individuals evaluate the project. The student is expected to:,,110
110.61.b.1.A,select a topic and define a purpose for an independent study project focused on a specific aspect of communication;,,110
110.61.b.1.B,review the research related to the topics identified;,,110
110.61.b.1.C,develop a formal proposal for the project; and,,110
110.61.b.1.D,plan the format and develop the timelines for production and presentation.,,110
110.61.b.2.A,"locate and gather information from a variety of primary and secondary sources, including electronic technology;",,110
110.61.b.2.B,use systematic strategies to organize and record information; and,,110
110.61.b.2.C,analyze the research data and develop conclusions to provide a basis for the project.,,110
110.61.b.3.A,"limit the chosen topic, purpose, and format for the presentation;",,110
110.61.b.3.B,develop systematic strategies to document the project;,,110
110.61.b.3.C,develop appropriate evaluation strategies for each aspect of the production and presentation of the project;,,110
110.61.b.3.D,organize and outline the text for the presentation;,,110
110.61.b.3.E,"choose appropriate proofs, literary texts, and/or scenes to develop and support the text;",,110
110.61.b.3.F,produce a written text of superior quality; and,,110
110.61.b.3.G,"review and revise plans, outlines, and scripts with the teacher.",,110
110.61.b.4.A,use rehearsal strategies to gain command of the text and enhance the communication and staging of the presentation;,,110
110.61.b.4.B,demonstrate appropriate verbal and nonverbal communication skills to enhance and enliven the presentation;,,110
110.61.b.4.C,"use appropriate visual and auditory aids to support, create interest, and/or add aesthetic appeal to the final presentation; and",,110
110.61.b.4.D,document the progress of the project and submit the final written text or script.,,110
110.61.b.5.A,use strategies to evaluate the project and the presentation; and,,110
110.61.b.5.B,analyze problems related to the project and assess implications for future projects.,,110
