TEKS ID,Statement,Grade,Chapter
110.2.a.2,"The seven strands of the essential knowledge and skills for English language arts and reading are intended to be integrated for instructional purposes and are recursive in nature. Strands include the four domains of language (listening, speaking, reading, and writing) and their application in order to accelerate the acquisition of language skills so that students develop high levels of social and academic language proficiency. Although some strands may require more instructional time, each strand is of equal value, may be presented in any order, and should be integrated throughout the year. It is important to note that encoding (spelling) and decoding (reading) are reciprocal skills. Decoding is internalized when tactile and kinesthetic opportunities (encoding) are provided. Additionally, students should engage in academic conversations, write, read, and be read to on a daily basis with opportunities for cross-curricular content and student choice.",,110
110.2.a.3,"Text complexity increases with challenging vocabulary, sophisticated sentence structures, nuanced text features, cognitively demanding content, and subtle relationships among ideas (Texas Education Agency, <i>STAAR Performance Level Descriptors</i>, 2013). As skills and knowledge are obtained in each of the seven strands, students will continue to apply earlier standards with greater depth to increasingly complex texts in multiple genres as they become self-directed, critical learners who work collaboratively while continuously using metacognitive skills.",,110
110.2.a.4,"English language learners (ELLs) are expected to meet standards in a second language; however, their proficiency in English influences the ability to meet these standards. To demonstrate this knowledge throughout the stages of English language acquisition, comprehension of text requires additional scaffolds such as adapted text, translations, native language support, cognates, summaries, pictures, realia, glossaries, bilingual dictionaries, thesauri, and other modes of comprehensible input. ELLs can and should be encouraged to use knowledge of their first language to enhance vocabulary development; vocabulary needs to be in the context of connected discourse so that it is meaningful. Strategic use of the student's first language is important to ensure linguistic, affective, cognitive, and academic development in English.",,110
110.2.a.6,"Oral language proficiency holds a pivotal role in school success; verbal engagement must be maximized across grade levels (Kinsella, 2010). In order for students to become thinkers and proficient speakers in science, social studies, mathematics, fine arts, language arts and reading, and career and technical education, they must have multiple opportunities to practice and apply the academic language of each discipline (Fisher, Frey, & Rothenberg, 2008).",,110
110.2.a.7,"Statements that contain the word ""including"" reference content that must be mastered, while those containing the phrase ""such as"" are intended as possible illustrative examples.",,110
110.2.b.1,"Developing and sustaining foundational language skills: listening, speaking, discussion, and thinking--oral language. The student develops oral language through listening, speaking, and discussion. The student is expected to:",,110
110.2.b.2,"Developing and sustaining foundational language skills: listening, speaking, reading, writing, and thinking--beginning reading and writing. The student develops word structure knowledge through phonological awareness, print concepts, phonics, and morphology to communicate, decode, and spell. The student is expected to:",,110
110.2.b.3,"Developing and sustaining foundational language skills: listening, speaking, reading, writing, and thinking--vocabulary. The student uses newly acquired vocabulary expressively. The student is expected to:",,110
110.2.b.4,"Developing and sustaining foundational language skills: listening, speaking, reading, writing, and thinking--self-sustained reading. The student reads grade-appropriate texts independently. The student is expected to self-select text and interact independently with text for increasing periods of time.",,110
110.2.b.5,"Comprehension skills: listening, speaking, reading, writing, and thinking using multiple texts. The student uses metacognitive skills to both develop and deepen comprehension of increasingly complex texts. The student is expected to:",,110
110.2.b.6,"Response skills: listening, speaking, reading, writing, and thinking using multiple texts. The student responds to an increasingly challenging variety of sources that are read, heard, or viewed. The student is expected to:",,110
110.2.b.7,"Multiple genres: listening, speaking, reading, writing, and thinking using multiple texts--literary elements. The student recognizes and analyzes literary elements within and across increasingly complex traditional, contemporary, classical, and diverse literary texts. The student is expected to:",,110
110.2.b.8,"Multiple genres: listening, speaking, reading, writing, and thinking using multiple texts--genres. The student recognizes and analyzes genre-specific characteristics, structures, and purposes within and across increasingly complex traditional, contemporary, classical, and diverse texts. The student is expected to:",,110
110.2.b.9,"Author's purpose and craft: listening, speaking, reading, writing, and thinking using multiple texts. The student uses critical inquiry to analyze the authors' choices and how they influence and communicate meaning within a variety of texts. The student analyzes and applies author's craft purposefully in order to develop his or her own products and performances. The student is expected to:",,110
110.2.b.10,"Composition: listening, speaking, reading, writing, and thinking using multiple texts--writing process. The student uses the writing process recursively to compose multiple texts that are legible and uses appropriate conventions. The student is expected to:",,110
110.2.b.11,"Composition: listening, speaking, reading, writing, and thinking using multiple texts--genres. The student uses genre characteristics and craft to compose multiple texts that are meaningful. The student is expected to:",,110
110.2.b.12,"Inquiry and research: listening, speaking, reading, writing, and thinking using multiple texts. The student engages in both short-term and sustained recursive inquiry processes for a variety of purposes. The student is expected to:",,110
110.2.b.1.A,listen actively and ask questions to understand information and answer questions using multi-word responses;,,110
110.2.b.1.B,"restate and follow oral directions that involve a short, related sequence of actions;",,110
110.2.b.1.C,share information and ideas by speaking audibly and clearly using the conventions of language;,,110
110.2.b.1.D,"work collaboratively with others by following agreed-upon rules for discussion, including taking turns; and",,110
110.2.b.1.E,"develop social communication such as introducing himself/herself, using common greetings, and expressing needs and wants.",,110
110.2.b.2.A,demonstrate phonological awareness by:,,110
110.2.b.2.B,demonstrate and apply phonetic knowledge by:,,110
110.2.b.2.C,demonstrate and apply spelling knowledge by:,,110
110.2.b.2.D,demonstrate print awareness by:,,110
110.2.b.2.E,develop handwriting by accurately forming all uppercase and lowercase letters using appropriate directionality.,,110
110.2.b.3.A,use a resource such as a picture dictionary or digital resource to find words;,,110
110.2.b.3.B,use illustrations and texts the student is able to read or hear to learn or clarify word meanings; and,,110
110.2.b.3.C,"identify and use words that name actions; directions; positions; sequences; categories such as colors, shapes, and textures; and locations.",,110
110.2.b.5.A,establish purpose for reading assigned and self-selected texts with adult assistance;,,110
110.2.b.5.B,"generate questions about text before, during, and after reading to deepen understanding and gain information with adult assistance;",,110
110.2.b.5.C,make and confirm predictions using text features and structures with adult assistance;,,110
110.2.b.5.D,create mental images to deepen understanding with adult assistance;,,110
110.2.b.5.E,"make connections to personal experiences, ideas in other texts, and society with adult assistance;",,110
110.2.b.5.F,make inferences and use evidence to support understanding with adult assistance;,,110
110.2.b.5.G,evaluate details to determine what is most important with adult assistance;,,110
110.2.b.5.H,synthesize information to create new understanding with adult assistance; and,,110
110.2.b.5.I,"monitor comprehension and make adjustments such as re-reading, using background knowledge, checking for visual cues, and asking questions when understanding breaks down with adult assistance.",,110
110.2.b.6.A,describe personal connections to a variety of sources;,,110
110.2.b.6.B,"provide an oral, pictorial, or written response to a text;",,110
110.2.b.6.C,use text evidence to support an appropriate response;,,110
110.2.b.6.D,retell texts in ways that maintain meaning;,,110
110.2.b.6.E,interact with sources in meaningful ways such as illustrating or writing; and,,110
110.2.b.6.F,respond using newly acquired vocabulary as appropriate.,,110
110.2.b.7.A,discuss topics and determine the basic theme using text evidence with adult assistance;,,110
110.2.b.7.B,identify and describe the main character(s);,,110
110.2.b.7.C,"describe the elements of plot development, including the main events, the problem, and the resolution for texts read aloud with adult assistance; and",,110
110.2.b.7.D,describe the setting.,,110
110.2.b.8.A,"demonstrate knowledge of distinguishing characteristics of well-known children's literature such as folktales, fables, fairy tales, and nursery rhymes;",,110
110.2.b.8.B,discuss rhyme and rhythm in nursery rhymes and a variety of poems;,,110
110.2.b.8.C,discuss main characters in drama;,,110
110.2.b.8.D,"recognize characteristics and structures of informational text, including:",,110
110.2.b.8.E,recognize characteristics of persuasive text with adult assistance and state what the author is trying to persuade the reader to think or do; and,,110
110.2.b.8.F,recognize characteristics of multimodal and digital texts.,,110
110.2.b.9.A,discuss with adult assistance the author's purpose for writing text;,,110
110.2.b.9.B,discuss with adult assistance how the use of text structure contributes to the author's purpose;,,110
110.2.b.9.C,discuss with adult assistance the author's use of print and graphic features to achieve specific purposes;,,110
110.2.b.9.D,discuss with adult assistance how the author uses words that help the reader visualize; and,,110
110.2.b.9.E,listen to and experience first- and third-person texts.,,110
110.2.b.10.A,plan by generating ideas for writing through class discussions and drawings;,,110
110.2.b.10.B,"develop drafts in oral, pictorial, or written form by organizing ideas;",,110
110.2.b.10.C,revise drafts by adding details in pictures or words;,,110
110.2.b.10.D,"edit drafts with adult assistance using standard English conventions, including:",,110
110.2.b.10.E,share writing.,,110
110.2.b.11.A,"dictate or compose literary texts, including personal narratives; and",,110
110.2.b.11.B,dictate or compose informational texts.,,110
110.2.b.12.A,generate questions for formal and informal inquiry with adult assistance;,,110
110.2.b.12.B,develop and follow a research plan with adult assistance;,,110
110.2.b.12.C,gather information from a variety of sources with adult assistance;,,110
110.2.b.12.D,demonstrate understanding of information gathered with adult assistance; and,,110
110.2.b.12.E,"use an appropriate mode of delivery, whether written, oral, or multimodal, to present results.",,110
110.36.b.1,"The English language arts and reading Texas Essential Knowledge and Skills (TEKS) embody the interconnected nature of listening, speaking, reading, writing, and thinking through the seven integrated strands of developing and sustaining foundational language skills; comprehension; response; multiple genres; author's purpose and craft; composition; and inquiry and research. The strands focus on academic oracy (proficiency in oral expression and comprehension), authentic reading, and reflective writing to ensure a literate Texas. The strands are integrated and progressive with students continuing to develop knowledge and skills with increased complexity and nuance in order to think critically and adapt to the ever-evolving nature of language and literacy.",,110
110.36.b.2,"The seven strands of the essential knowledge and skills for English language arts and reading are intended to be integrated for instructional purposes and are recursive in nature. Strands include the four domains of language (listening, speaking, reading, and writing) and their application in order to accelerate the acquisition of language skills so that students develop high levels of social and academic language proficiency. Although some strands may require more instructional time, each strand is of equal value, may be presented in any order, and should be integrated throughout the year. Additionally, students should engage in academic conversations, write, read, and be read to on a daily basis with opportunities for cross-curricular content and student choice.",,110
110.36.b.3,"Text complexity increases with challenging vocabulary, sophisticated sentence structures, nuanced text features, cognitively demanding content, and subtle relationships among ideas (Texas Education Agency, <i>STAAR Performance Level Descriptors</i>, 2013). As skills and knowledge are obtained in each of the seven strands, students will continue to apply earlier standards with greater depth to increasingly complex texts in multiple genres as they become self-directed, critical learners who work collaboratively while continuously using metacognitive skills.",,110
110.36.b.4,"English language learners (ELLs) are expected to meet standards in a second language; however, their proficiency in English influences the ability to meet these standards. To demonstrate this knowledge throughout the stages of English language acquisition, comprehension of text requires additional scaffolds such as adapted text, translations, native language support, cognates, summaries, pictures, realia, glossaries, bilingual dictionaries, thesauri, and other modes of comprehensible input. ELLs can and should be encouraged to use knowledge of their first language to enhance vocabulary development; vocabulary needs to be in the context of connected discourse so that it is meaningful. Strategic use of the student's first language is important to ensure linguistic, affective, cognitive, and academic development in English.",,110
110.36.b.6,"Oral language proficiency holds a pivotal role in school success; verbal engagement must be maximized across grade levels (Kinsella, 2010). In order for students to become thinkers and proficient speakers in science, social studies, mathematics, fine arts, language arts and reading, and career and technical education, they must have multiple opportunities to practice and apply the academic language of each discipline (Fisher, Frey, & Rothenberg, 2008).",,110
110.36.b.7,"Statements that contain the word ""including"" reference content that must be mastered, while those containing the phrase ""such as"" are intended as possible illustrative examples.",,110
110.36.c.1,"Developing and sustaining foundational language skills: listening, speaking, discussion, and thinking--oral language. The student develops oral language through listening, speaking, and discussion. The student is expected to:",,110
110.36.c.2,"Developing and sustaining foundational language skills: listening, speaking, reading, writing, and thinking--vocabulary. The student uses newly acquired vocabulary expressively. The student is expected to:",,110
110.36.c.3,"Developing and sustaining foundational language skills: listening, speaking, reading, writing, and thinking--self-sustained reading. The student reads grade-appropriate texts independently. The student is expected to self-select text and read independently for a sustained period of time.",,110
110.36.c.4,"Comprehension skills: listening, speaking, reading, writing, and thinking using multiple texts. The student uses metacognitive skills to both develop and deepen comprehension of increasingly complex texts. The student is expected to:",,110
110.36.c.5,"Response skills: listening, speaking, reading, writing, and thinking using multiple texts. The student responds to an increasingly challenging variety of sources that are read, heard, or viewed. The student is expected to:",,110
110.36.c.6,"Multiple genres: listening, speaking, reading, writing, and thinking using multiple texts--literary elements. The student recognizes and analyzes literary elements within and across increasingly complex traditional, contemporary, classical, and diverse literary texts. The student is expected to:",,110
110.36.c.7,"Multiple genres: listening, speaking, reading, writing, and thinking using multiple texts--genres. The student recognizes and analyzes genre-specific characteristics, structures, and purposes within and across increasingly complex traditional, contemporary, classical, and diverse texts. The student is expected to:",,110
110.36.c.8,"Author's purpose and craft: listening, speaking, reading, writing, and thinking using multiple texts. The student uses critical inquiry to analyze the authors' choices and how they influence and communicate meaning within a variety of texts. The student analyzes and applies author's craft purposefully in order to develop his or her own products and performances. The student is expected to:",,110
110.36.c.9,"Composition: listening, speaking, reading, writing, and thinking using multiple texts--writing process. The student uses the writing process recursively to compose multiple texts that are legible and use appropriate conventions. The student is expected to:",,110
110.36.c.10,"Composition: listening, speaking, reading, writing, and thinking using multiple texts--genres. The student uses genre characteristics and craft to compose multiple texts that are meaningful. The student is expected to:",,110
110.36.c.11,"Inquiry and research: listening, speaking, reading, writing, and thinking using multiple texts. The student engages in both short-term and sustained recursive inquiry processes for a variety of purposes. The student is expected to:",,110
110.36.c.1.A,"engage in meaningful and respectful discourse by listening actively, responding appropriately, and adjusting communication to audiences and purposes;",,110
110.36.c.1.B,"follow and give complex oral instructions to perform specific tasks, answer questions, or solve problems and complex processes;",,110
110.36.c.1.C,"give a presentation using informal, formal, and technical language effectively to meet the needs of audience, purpose, and occasion, employing eye contact, speaking rate such as pauses for effect, volume, enunciation, purposeful gestures, and conventions of language to communicate ideas effectively; and",,110
110.36.c.1.D,"participate collaboratively, building on the ideas of others, contributing relevant information, developing a plan for consensus building, and setting ground rules for decision making.",,110
110.36.c.2.A,use print or digital resources such as glossaries or technical dictionaries to clarify and validate understanding of the precise and appropriate meaning of technical or discipline-based vocabulary;,,110
110.36.c.2.B,analyze context to distinguish between the denotative and connotative meanings of words; and,,110
110.36.c.2.C,"determine the meaning of foreign words or phrases used frequently in English such as bona fide, caveat, carte blanche, tête-à-tête, bon appétit, and quid pro quo.",,110
110.36.c.4.A,establish purpose for reading assigned and self-selected texts;,,110
110.36.c.4.B,"generate questions about text before, during, and after reading to deepen understanding and gain information;",,110
110.36.c.4.C,"make and correct or confirm predictions using text features, characteristics of genre, and structures;",,110
110.36.c.4.D,create mental images to deepen understanding;,,110
110.36.c.4.E,"make connections to personal experiences, ideas in other texts, and society;",,110
110.36.c.4.F,make inferences and use evidence to support understanding;,,110
110.36.c.4.G,evaluate details read to determine key ideas;,,110
110.36.c.4.H,synthesize information from two texts to create new understanding; and,,110
110.36.c.4.I,"monitor comprehension and make adjustments such as re-reading, using background knowledge, asking questions, and annotating when understanding breaks down.",,110
110.36.c.5.A,"describe personal connections to a variety of sources, including self-selected texts;",,110
110.36.c.5.B,"write responses that demonstrate understanding of texts, including comparing texts within and across genres;",,110
110.36.c.5.C,use text evidence and original commentary to support a comprehensive response;,,110
110.36.c.5.D,paraphrase and summarize texts in ways that maintain meaning and logical order;,,110
110.36.c.5.E,"interact with sources in meaningful ways such as notetaking, annotating, freewriting, or illustrating;",,110
110.36.c.5.F,respond using acquired content and academic vocabulary as appropriate;,,110
110.36.c.5.G,discuss and write about the explicit or implicit meanings of text;,,110
110.36.c.5.H,"respond orally or in writing with appropriate register, vocabulary, tone, and voice;",,110
110.36.c.5.I,reflect on and adjust responses when valid evidence warrants; and,,110
110.36.c.5.J,defend or challenge the authors' claims using relevant text evidence.,,110
110.36.c.6.A,analyze how themes are developed through characterization and plot in a variety of literary texts;,,110
110.36.c.6.B,"analyze how authors develop complex yet believable characters in works of fiction through a range of literary devices, including character foils;",,110
110.36.c.6.C,"analyze non-linear plot development such as flashbacks, foreshadowing, subplots, and parallel plot structures and compare it to linear plot development; and",,110
110.36.c.6.D,analyze how the setting influences the theme.,,110
110.36.c.7.A,"read and respond to American, British, and world literature;",,110
110.36.c.7.B,"analyze the structure, prosody, and graphic elements such as line length and word position in poems across a variety of poetic forms;",,110
110.36.c.7.C,"analyze the function of dramatic conventions such as asides, soliloquies, dramatic irony, and satire;",,110
110.36.c.7.D,analyze characteristics and structural elements of informational texts such as:,,110
110.36.c.7.E,analyze characteristics and structural elements of argumentative texts such as:,,110
110.36.c.7.F,analyze characteristics of multimodal and digital texts.,,110
110.36.c.7.D.i,"clear thesis, relevant supporting evidence, pertinent examples, and conclusion; and",,110
110.36.c.7.D.ii,multiple organizational patterns within a text to develop the thesis;,,110
110.36.c.7.E.i,"clear arguable claim, appeals, and convincing conclusion;",,110
110.36.c.7.E.ii,"various types of evidence and treatment of counterarguments, including concessions and rebuttals; and",,110
110.36.c.7.E.iii,identifiable audience or reader; and,,110
110.36.c.8.A,"analyze the author's purpose, audience, and message within a text;",,110
110.36.c.8.B,analyze use of text structure to achieve the author's purpose;,,110
110.36.c.8.C,evaluate the author's use of print and graphic features to achieve specific purposes;,,110
110.36.c.8.D,analyze how the author's use of language achieves specific purposes;,,110
110.36.c.8.E,analyze the use of literary devices such as irony and oxymoron to achieve specific purposes;,,110
110.36.c.8.F,"analyze how the author's diction and syntax contribute to the mood, voice, and tone of a text; and",,110
110.36.c.8.G,explain the purpose of rhetorical devices such as understatement and overstatement and the effect of logical fallacies such as straw man and red herring arguments.,,110
110.36.c.9.A,"plan a piece of writing appropriate for various purposes and audiences by generating ideas through a range of strategies such as brainstorming, journaling, reading, or discussing;",,110
110.36.c.9.B,"develop drafts into a focused, structured, and coherent piece of writing in timed and open-ended situations by:",,110
110.36.c.9.C,"revise drafts to improve clarity, development, organization, style, diction, and sentence effectiveness, including use of parallel constructions and placement of phrases and dependent clauses;",,110
110.36.c.9.D,"edit drafts using standard English conventions, including:",,110
110.36.c.9.E,publish written work for appropriate audiences.,,110
110.36.c.9.B.i,"using an organizing structure appropriate to purpose, audience, topic, and context; and",,110
110.36.c.9.B.ii,"developing an engaging idea reflecting depth of thought with specific details, examples, and commentary;",,110
110.36.c.9.D.i,"a variety of complete, controlled sentences and avoidance of unintentional splices, run-ons, and fragments;",,110
110.36.c.9.D.ii,"consistent, appropriate use of verb tense and active and passive voice;",,110
110.36.c.9.D.iii,pronoun-antecedent agreement;,,110
110.36.c.9.D.iv,correct capitalization;,,110
110.36.c.9.D.v,"punctuation, including commas, semicolons, colons, and dashes to set off phrases and clauses as appropriate; and",,110
110.36.c.9.D.vi,correct spelling; and,,110
110.36.c.10.A,compose literary texts such as fiction and poetry using genre characteristics and craft;,,110
