TEKS ID,Statement,Grade,Chapter
110.3.a.4,"English language learners (ELLs) are expected to meet standards in a second language; however, their proficiency in English influences the ability to meet these standards. To demonstrate this knowledge throughout the stages of English language acquisition, comprehension of text requires additional scaffolds such as adapted text, translations, native language support, cognates, summaries, pictures, realia, glossaries, bilingual dictionaries, thesauri, and other modes of comprehensible input. ELLs can and should be encouraged to use knowledge of their first language to enhance vocabulary development; vocabulary needs to be in the context of connected discourse so that it is meaningful. Strategic use of the student's first language is important to ensure linguistic, affective, cognitive, and academic development in English.",,110
110.3.a.6,"Oral language proficiency holds a pivotal role in school success; verbal engagement must be maximized across grade levels (Kinsella, 2010). In order for students to become thinkers and proficient speakers in science, social studies, mathematics, fine arts, language arts and reading, and career and technical education, they must have multiple opportunities to practice and apply the academic language of each discipline (Fisher, Frey, & Rothenberg, 2008).",,110
110.3.a.7,"Statements that contain the word ""including"" reference content that must be mastered, while those containing the phrase ""such as"" are intended as possible illustrative examples.",,110
110.3.b.1,"Developing and sustaining foundational language skills: listening, speaking, discussion, and thinking--oral language. The student develops oral language through listening, speaking, and discussion. The student is expected to:",,110
110.3.b.2,"Developing and sustaining foundational language skills: listening, speaking, reading, writing, and thinking--beginning reading and writing. The student develops word structure knowledge through phonological awareness, print concepts, phonics, and morphology to communicate, decode, and spell. The student is expected to:",,110
110.3.b.3,"Developing and sustaining foundational language skills: listening, speaking, reading, writing, and thinking--vocabulary. The student uses newly acquired vocabulary expressively. The student is expected to:",,110
110.3.b.4,"Developing and sustaining foundational language skills: listening, speaking, reading, writing, and thinking--fluency. The student reads grade-level text with fluency and comprehension. The student is expected to use appropriate fluency (rate, accuracy, and prosody) when reading grade-level text.",,110
110.3.b.5,"Developing and sustaining foundational language skills: listening, speaking, reading, writing, and thinking--self-sustained reading. The student reads grade-appropriate texts independently. The student is expected to self-select text and interact independently with text for increasing periods of time.",,110
110.3.b.6,"Comprehension skills: listening, speaking, reading, writing, and thinking using multiple texts. The student uses metacognitive skills to both develop and deepen comprehension of increasingly complex texts. The student is expected to:",,110
110.3.b.7,"Response skills: listening, speaking, reading, writing, and thinking using multiple texts. The student responds to an increasingly challenging variety of sources that are read, heard, or viewed. The student is expected to:",,110
110.3.b.8,"Multiple genres: listening, speaking, reading, writing, and thinking using multiple texts--literary elements. The student recognizes and analyzes literary elements within and across increasingly complex traditional, contemporary, classical, and diverse literary texts. The student is expected to:",,110
110.3.b.9,"Multiple genres: listening, speaking, reading, writing, and thinking using multiple texts--genres. The student recognizes and analyzes genre-specific characteristics, structures, and purposes within and across increasingly complex traditional, contemporary, classical, and diverse texts. The student is expected to:",,110
110.3.b.10,"Author's purpose and craft: listening, speaking, reading, writing, and thinking using multiple texts. The student uses critical inquiry to analyze the authors' choices and how they influence and communicate meaning within a variety of texts. The student analyzes and applies author's craft purposefully in order to develop his or her own products and performances. The student is expected to:",,110
110.3.b.11,"Composition: listening, speaking, reading, writing, and thinking using multiple texts--writing process. The student uses the writing process recursively to compose multiple texts that are legible and uses appropriate conventions. The student is expected to:",,110
110.3.b.12,"Composition: listening, speaking, reading, writing, and thinking using multiple texts--genres. The student uses genre characteristics and craft to compose multiple texts that are meaningful. The student is expected to:",,110
110.3.b.13,"Inquiry and research: listening, speaking, reading, writing, and thinking using multiple texts. The student engages in both short-term and sustained recursive inquiry processes for a variety of purposes. The student is expected to:",,110
110.3.b.1.A,"listen actively, ask relevant questions to clarify information, and answer questions using multi-word responses;",,110
110.3.b.1.B,"follow, restate, and give oral instructions that involve a short, related sequence of actions;",,110
110.3.b.1.C,"share information and ideas about the topic under discussion, speaking clearly at an appropriate pace and using the conventions of language;",,110
110.3.b.1.D,"work collaboratively with others by following agreed-upon rules for discussion, including listening to others, speaking when recognized, and making appropriate contributions; and",,110
110.3.b.1.E,"develop social communication such as introducing himself/herself and others, relating experiences to a classmate, and expressing needs and feelings.",,110
110.3.b.2.A,demonstrate phonological awareness by:,,110
110.3.b.2.B,demonstrate and apply phonetic knowledge by:,,110
110.3.b.2.C,demonstrate and apply spelling knowledge by:,,110
110.3.b.2.D,demonstrate print awareness by identifying the information that different parts of a book provide;,,110
110.3.b.2.E,alphabetize a series of words to the first or second letter and use a dictionary to find words; and,,110
110.3.b.2.F,"develop handwriting by printing words, sentences, and answers legibly leaving appropriate spaces between words.",,110
110.3.b.2.A.i,producing a series of rhyming words;,,110
110.3.b.2.A.ii,recognizing spoken alliteration or groups of words that begin with the same spoken onset or initial sound;,,110
110.3.b.2.A.iii,distinguishing between long and short vowel sounds in one-syllable words;,,110
110.3.b.2.A.iv,"recognizing the change in spoken word when a specified phoneme is added, changed, or removed;",,110
110.3.b.2.A.v,"blending spoken phonemes to form one-syllable words, including initial and/or final consonant blends;",,110
110.3.b.2.A.vi,manipulating phonemes within base words; and,,110
110.3.b.2.A.vii,"segmenting spoken one-syllable words of three to five phonemes into individual phonemes, including words with initial and/or final consonant blends;",,110
110.3.b.2.B.i,decoding words in isolation and in context by applying common letter sound correspondences;,,110
110.3.b.2.B.ii,"decoding words with initial and final consonant blends, digraphs, and trigraphs;",,110
110.3.b.2.B.iii,"decoding words with closed syllables; open syllables; VCe syllables; vowel teams, including vowel digraphs and diphthongs; and r-controlled syllables;",,110
110.3.b.2.B.iv,using knowledge of base words to decode common compound words and contractions;,,110
110.3.b.2.B.v,"decoding words with inflectional endings, including -ed, -s, and -es; and",,110
110.3.b.2.B.vi,identifying and reading at least 100 high-frequency words from a research-based list;,,110
110.3.b.2.C.i,"spelling words with closed syllables, open syllables, VCe syllables, vowel teams, and r-controlled syllables;",,110
110.3.b.2.C.ii,"spelling words with initial and final consonant blends, digraphs, and trigraphs;",,110
110.3.b.2.C.iii,spelling words using sound-spelling patterns; and,,110
110.3.b.2.C.iv,spelling high-frequency words from a research-based list;,,110
110.3.b.3.A,use a resource such as a picture dictionary or digital resource to find words;,,110
110.3.b.3.B,use illustrations and texts the student is able to read or hear to learn or clarify word meanings;,,110
110.3.b.3.C,"identify the meaning of words with the affixes -s, -ed, and -ing; and",,110
110.3.b.3.D,"identify and use words that name actions, directions, positions, sequences, categories, and locations.",,110
110.3.b.6.A,establish purpose for reading assigned and self-selected texts with adult assistance;,,110
110.3.b.6.B,"generate questions about text before, during, and after reading to deepen understanding and gain information with adult assistance;",,110
110.3.b.6.C,"make and correct or confirm predictions using text features, characteristics of genre, and structures with adult assistance;",,110
110.3.b.6.D,create mental images to deepen understanding with adult assistance;,,110
110.3.b.6.E,"make connections to personal experiences, ideas in other texts, and society with adult assistance;",,110
110.3.b.6.F,make inferences and use evidence to support understanding with adult assistance;,,110
110.3.b.6.G,evaluate details to determine what is most important with adult assistance;,,110
110.3.b.6.H,synthesize information to create new understanding with adult assistance; and,,110
110.3.b.6.I,"monitor comprehension and make adjustments such as re-reading, using background knowledge, checking for visual cues, and asking questions when understanding breaks down.",,110
110.3.b.7.A,describe personal connections to a variety of sources;,,110
110.3.b.7.B,write brief comments on literary or informational texts;,,110
110.3.b.7.C,use text evidence to support an appropriate response;,,110
110.3.b.7.D,retell texts in ways that maintain meaning;,,110
110.3.b.7.E,interact with sources in meaningful ways such as illustrating or writing; and,,110
110.3.b.7.F,respond using newly acquired vocabulary as appropriate.,,110
110.3.b.8.A,discuss topics and determine theme using text evidence with adult assistance;,,110
110.3.b.8.B,describe the main character(s) and the reason(s) for their actions;,,110
110.3.b.8.C,"describe plot elements, including the main events, the problem, and the resolution, for texts read aloud and independently; and",,110
110.3.b.8.D,describe the setting.,,110
110.3.b.9.A,"demonstrate knowledge of distinguishing characteristics of well-known children's literature such as folktales, fables, fairy tales, and nursery rhymes;",,110
110.3.b.9.B,"discuss rhyme, rhythm, repetition, and alliteration in a variety of poems;",,110
110.3.b.9.C,discuss elements of drama such as characters and setting;,,110
110.3.b.9.D,"recognize characteristics and structures of informational text, including:",,110
110.3.b.9.E,recognize characteristics of persuasive text with adult assistance and state what the author is trying to persuade the reader to think or do; and,,110
110.3.b.9.F,recognize characteristics of multimodal and digital texts.,,110
110.3.b.9.D.i,the central idea and supporting evidence with adult assistance;,,110
110.3.b.9.D.ii,features and simple graphics to locate or gain information; and,,110
110.3.b.9.D.iii,organizational patterns such as chronological order and description with adult assistance;,,110
110.3.b.10.A,discuss the author's purpose for writing text;,,110
110.3.b.10.B,discuss how the use of text structure contributes to the author's purpose;,,110
110.3.b.10.C,discuss with adult assistance the author's use of print and graphic features to achieve specific purposes;,,110
110.3.b.10.D,discuss how the author uses words that help the reader visualize; and,,110
110.3.b.10.E,listen to and experience first- and third-person texts.,,110
110.3.b.11.A,plan a first draft by generating ideas for writing such as by drawing and brainstorming;,,110
110.3.b.11.B,"develop drafts in oral, pictorial, or written form by:",,110
110.3.b.11.C,revise drafts by adding details in pictures or words;,,110
110.3.b.11.D,"edit drafts using standard English conventions, including:",,110
110.3.b.11.E,publish and share writing.,,110
110.3.b.11.B.i,organizing with structure; and,,110
110.3.b.11.B.ii,developing an idea with specific and relevant details;,,110
110.3.b.11.D.i,complete sentences with subject-verb agreement;,,110
110.3.b.11.D.ii,past and present verb tense;,,110
110.3.b.11.D.iii,"singular, plural, common, and proper nouns;",,110
110.3.b.11.D.iv,"adjectives, including articles;",,110
110.3.b.11.D.v,adverbs that convey time;,,110
110.3.b.11.D.vi,prepositions;,,110
110.3.b.11.D.vii,"pronouns, including subjective, objective, and possessive cases;",,110
110.3.b.11.D.viii,"capitalization for the beginning of sentences and the pronoun ""I"";",,110
110.3.b.11.D.ix,"punctuation marks at the end of declarative, exclamatory, and interrogative sentences; and",,110
110.3.b.11.D.x,correct spelling of words with grade-appropriate orthographic patterns and rules and high-frequency words with adult assistance; and,,110
110.3.b.12.A,"dictate or compose literary texts, including personal narratives and poetry;",,110
110.3.b.12.B,"dictate or compose informational texts, including procedural texts; and",,110
110.3.b.12.C,dictate or compose correspondence such as thank you notes or letters.,,110
110.3.b.13.A,generate questions for formal and informal inquiry with adult assistance;,,110
110.3.b.13.B,develop and follow a research plan with adult assistance;,,110
110.3.b.13.C,identify and gather relevant sources and information to answer the questions with adult assistance;,,110
110.3.b.13.D,demonstrate understanding of information gathered with adult assistance; and,,110
110.3.b.13.E,"use an appropriate mode of delivery, whether written, oral, or multimodal, to present results.",,110
110.4.a.1,"The English language arts and reading Texas Essential Knowledge and Skills (TEKS) embody the interconnected nature of listening, speaking, reading, writing, and thinking through the seven integrated strands of developing and sustaining foundational language skills; comprehension; response; multiple genres; author's purpose and craft; composition; and inquiry and research. The strands focus on academic oracy (proficiency in oral expression and comprehension), authentic reading, and reflective writing to ensure a literate Texas. The strands are integrated and progressive with students continuing to develop knowledge and skills with increased complexity and nuance in order to think critically and adapt to the ever-evolving nature of language and literacy.",,110
110.4.a.2,"The seven strands of the essential knowledge and skills for English language arts and reading are intended to be integrated for instructional purposes and are recursive in nature. Strands include the four domains of language (listening, speaking, reading, writing) and their application in order to accelerate the acquisition of language skills so that students develop high levels of social and academic language proficiency. Although some strands may require more instructional time, each strand is of equal value, may be presented in any order, and should be integrated throughout the year. It is important to note that encoding (spelling) and decoding (reading) are reciprocal skills. Decoding is internalized when tactile and kinesthetic opportunities (encoding) are provided. Additionally, students should engage in academic conversations, write, read, and be read to on a daily basis with opportunities for cross-curricular content and student choice.",,110
110.4.a.3,"Text complexity increases with challenging vocabulary, sophisticated sentence structures, nuanced text features, cognitively demanding content, and subtle relationships among ideas (Texas Education Agency, <i>STAAR Performance Level Descriptors</i>, 2013). As skills and knowledge are obtained in each of the seven strands, students will continue to apply earlier standards with greater depth to increasingly complex texts in multiple genres as they become self-directed, critical learners who work collaboratively while continuously using metacognitive skills.",,110
110.4.a.4,"English language learners (ELLs) are expected to meet standards in a second language; however, their proficiency in English influences the ability to meet these standards. To demonstrate this knowledge throughout the stages of English language acquisition, comprehension of text requires additional scaffolds such as adapted text, translations, native language support, cognates, summaries, pictures, realia, glossaries, bilingual dictionaries, thesauri, and other modes of comprehensible input. ELLs can and should be encouraged to use knowledge of their first language to enhance vocabulary development; vocabulary needs to be in the context of connected discourse so that it is meaningful. Strategic use of the student's first language is important to ensure linguistic, affective, cognitive, and academic development in English.",,110
110.4.a.6,"Oral language proficiency holds a pivotal role in school success; verbal engagement must be maximized across grade levels (Kinsella, 2010). In order for students to become thinkers and proficient speakers in science, social studies, mathematics, fine arts, language arts and reading, and career and technical education, they must have multiple opportunities to practice and apply the academic language of each discipline (Fisher, Frey, & Rothenberg, 2008).",,110
110.4.a.7,"Statements that contain the word ""including"" reference content that must be mastered, while those containing the phrase ""such as"" are intended as possible illustrative examples.",,110
110.4.b.1,"Developing and sustaining foundational language skills: listening, speaking, discussion, and thinking--oral language. The student develops oral language through listening, speaking, and discussion. The student is expected to:",,110
110.4.b.2,"Developing and sustaining foundational language skills: listening, speaking, reading, writing, and thinking--beginning reading and writing. The student develops word structure knowledge through phonological awareness, print concepts, phonics, and morphology to communicate, decode, and spell. The student is expected to:",,110
110.4.b.3,"Developing and sustaining foundational language skills: listening, speaking, reading, writing, and thinking--vocabulary. The student uses newly acquired vocabulary expressively. The student is expected to:",,110
110.4.b.4,"Developing and sustaining foundational language skills: listening, speaking, reading, writing, and thinking--fluency. The student reads grade-level text with fluency and comprehension. The student is expected to use appropriate fluency (rate, accuracy, and prosody) when reading grade-level text.",,110
110.4.b.5,"Developing and sustaining foundational language skills: listening, speaking, reading, writing, and thinking--self-sustained reading. The student reads grade-appropriate texts independently. The student is expected to self-select text and read independently for a sustained period of time.",,110
110.4.b.6,"Comprehension skills: listening, speaking, reading, writing, and thinking using multiple texts. The student uses metacognitive skills to both develop and deepen comprehension of increasingly complex texts. The student is expected to:",,110
110.4.b.7,"Response skills: listening, speaking, reading, writing, and thinking using multiple texts. The student responds to an increasingly challenging variety of sources that are read, heard, or viewed. The student is expected to:",,110
110.4.b.8,"Multiple genres: listening, speaking, reading, writing, and thinking using multiple texts--literary elements. The student recognizes and analyzes literary elements within and across increasingly complex traditional, contemporary, classical, and diverse literary texts. The student is expected to:",,110
110.4.b.9,"Multiple genres: listening, speaking, reading, writing, and thinking using multiple texts--genres. The student recognizes and analyzes genre-specific characteristics, structures, and purposes within and across increasingly complex traditional, contemporary, classical, and diverse texts. The student is expected to:",,110
110.4.b.10,"Author's purpose and craft: listening, speaking, reading, writing, and thinking using multiple texts. The student uses critical inquiry to analyze the authors' choices and how they influence and communicate meaning within a variety of texts. The student analyzes and applies author's craft purposefully in order to develop his or her own products and performances. The student is expected to:",,110
110.4.b.11,"Composition: listening, speaking, reading, writing, and thinking using multiple texts--writing process. The student uses the writing process recursively to compose multiple texts that are legible and uses appropriate conventions. The student is expected to:",,110
110.4.b.12,"Composition: listening, speaking, reading, writing, and thinking using multiple texts--genres. The student uses genre characteristics and craft to compose multiple texts that are meaningful. The student is expected to:",,110
110.4.b.13,"Inquiry and research: listening, speaking, reading, writing, and thinking using multiple texts. The student engages in both short-term and sustained recursive inquiry processes for a variety of purposes. The student is expected to:",,110
110.4.b.1.A,"listen actively, ask relevant questions to clarify information, and answer questions using multi-word responses;",,110
110.4.b.1.B,"follow, restate, and give oral instructions that involve a short, related sequence of actions;",,110
110.4.b.1.C,"share information and ideas that focus on the topic under discussion, speaking clearly at an appropriate pace and using the conventions of language;",,110
110.4.b.1.D,"work collaboratively with others by following agreed-upon rules for discussion, including listening to others, speaking when recognized, making appropriate contributions, and building on the ideas of others; and",,110
110.4.b.1.E,develop social communication such as distinguishing between asking and telling.,,110
110.4.b.2.A,demonstrate phonological awareness by:,,110
110.4.b.2.B,demonstrate and apply phonetic knowledge by:,,110
110.4.b.2.C,demonstrate and apply spelling knowledge by:,,110
110.4.b.2.D,alphabetize a series of words and use a dictionary or glossary to find words; and,,110
110.4.b.2.E,develop handwriting by accurately forming all cursive letters using appropriate strokes when connecting letters.,,110
110.4.b.2.A.i,producing a series of rhyming words;,,110
110.4.b.2.A.ii,distinguishing between long and short vowel sounds in one-syllable and multi-syllable words;,,110
110.4.b.2.A.iii,"recognizing the change in spoken word when a specified phoneme is added, changed, or removed; and",,110
110.4.b.2.A.iv,manipulating phonemes within base words;,,110
110.4.b.2.B.i,"decoding words with short, long, or variant vowels, trigraphs, and blends;",,110
110.4.b.2.B.ii,decoding words with silent letters such as knife and gnat;,,110
110.4.b.2.B.iii,"decoding multisyllabic words with closed syllables; open syllables; VCe syllables; vowel teams, including digraphs and diphthongs; r-controlled syllables; and final stable syllables;",,110
110.4.b.2.B.iv,"decoding compound words, contractions, and common abbreviations;",,110
110.4.b.2.B.v,"decoding words using knowledge of syllable division patterns such as VCCV, VCV, and VCCCV;",,110
110.4.b.2.B.vi,"decoding words with prefixes, including un-, re-, and dis-, and inflectional endings, including -s, -es, -ed, -ing, -er, and -est; and",,110
110.4.b.2.B.vii,identifying and reading high-frequency words from a research-based list;,,110
110.4.b.2.C.i,"spelling one-syllable and multisyllabic words with closed syllables; open syllables; VCe syllables; vowel teams, including digraphs and diphthongs; r-controlled syllables; and final stable syllables;",,110
110.4.b.2.C.ii,spelling words with silent letters such as knife and gnat;,,110
110.4.b.2.C.iii,"spelling compound words, contractions, and common abbreviations;",,110
110.4.b.2.C.iv,spelling multisyllabic words with multiple sound-spelling patterns;,,110
110.4.b.2.C.v,"spelling words using knowledge of syllable division patterns, including words with double consonants in the middle of the word; and",,110
110.4.b.2.C.vi,"spelling words with prefixes, including un-, re-, and dis-, and inflectional endings, including -s, -es, -ed, -ing, -er, and -est;",,110
110.4.b.3.A,use print or digital resources to determine meaning and pronunciation of unknown words;,,110
110.4.b.3.B,use context within and beyond a sentence to determine the meaning of unfamiliar words;,,110
110.4.b.3.C,"identify the meaning of and use words with affixes un-, re-, -ly, -er, and -est (comparative and superlative), and -ion/tion/sion; and",,110
110.4.b.3.D,"identify, use, and explain the meaning of antonyms, synonyms, idioms, and homographs in context.",,110
110.4.b.6.A,establish purpose for reading assigned and self-selected texts;,,110
110.4.b.6.B,"generate questions about text before, during, and after reading to deepen understanding and gain information;",,110
110.4.b.6.C,"make and correct or confirm predictions using text features, characteristics of genre, and structures;",,110
110.4.b.6.D,create mental images to deepen understanding;,,110
110.4.b.6.E,"make connections to personal experiences, ideas in other texts, and society;",,110
110.4.b.6.F,make inferences and use evidence to support understanding;,,110
