TEKS ID,Statement,Grade,Chapter
113.41.d.17.D,"identify the actions and outcomes of government policies intended to create economic opportunities for citizens such as the Great Society, affirmative action, and Title IX; and",HS,113
113.41.d.17.E,"describe the dynamic relationship between U.S. international trade policies and the U.S. free enterprise system such as the Organization of Petroleum Exporting Countries (OPEC) oil embargo, the General Agreement on Tariffs and Trade (GATT), and the North American Free Trade Agreement (NAFTA).",HS,113
113.41.d.18.A,evaluate the impact of New Deal legislation on the historical roles of state and federal government;,HS,113
113.41.d.18.B,"explain constitutional issues raised by federal government policy changes during times of significant events, including World War I, the Great Depression, World War II, the 1960s, and September 11, 2001;",HS,113
113.41.d.18.C,"describe the effects of political scandals, including Teapot Dome, Watergate, and Bill Clinton's impeachment, on the views of U.S. citizens concerning trust in the federal government and its leaders; and",HS,113
113.41.d.18.D,"describe the role of contemporary government legislation in the private and public sectors such as the Community Reinvestment Act of 1977, USA PATRIOT Act of 2001, and the American Recovery and Reinvestment Act of 2009.",HS,113
113.41.d.19.A,describe the impact of events such as the Gulf of Tonkin Resolution and the War Powers Act on the relationship between the legislative and executive branches of government; and,HS,113
113.41.d.19.B,"evaluate the impact of relationships among the legislative, executive, and judicial branches of government, including Franklin D. Roosevelt's attempt to increase the number of U.S. Supreme Court justices and the presidential election of 2000.",HS,113
113.41.d.20.A,"analyze the effects of landmark U.S. Supreme Court decisions, including Plessy v. Ferguson, Brown v. Board of Education, Hernandez v. Texas, Tinker v. Des Moines, and Wisconsin v. Yoder; and",HS,113
113.41.d.20.B,explain why landmark constitutional amendments have been proposed and ratified from 1877 to the present.,HS,113
113.41.d.21.A,"discuss values crucial to America's success as a constitutional republic, including liberty, egalitarianism, individualism, populism, and laissez-faire; and",HS,113
113.41.d.21.B,describe how American values are different and unique from those of other nations.,HS,113
113.41.d.22.A,"identify and analyze methods of expanding the right to participate in the democratic process, including lobbying, non-violent protesting, litigation, and amendments to the U.S. Constitution;",HS,113
113.41.d.22.B,"evaluate various means of achieving equality of political rights, including the 19th, 24th, and 26th amendments and congressional acts such as the American Indian Citizenship Act of 1924;",HS,113
113.41.d.22.C,"explain how participation in the democratic process reflects our national identity, patriotism, and civic responsibility; and",HS,113
113.41.d.22.D,summarize the criteria and explain the process for becoming a naturalized citizen of the United States.,HS,113
113.41.d.23.A,"evaluate the contributions of significant political and social leaders in the United States such as Andrew Carnegie, Thurgood Marshall, Billy Graham, Sandra Day O'Connor, and Hillary Clinton; and",HS,113
113.41.d.23.B,"explain the importance of Congressional Medal of Honor recipients such as Army First Lieutenant Vernon J. Baker, Army Corporal Alvin York, and Army Master Sergeant Raul ""Roy"" Perez Benavidez.",HS,113
113.41.d.24.A,"describe how the characteristics of and issues in U.S. history have been reflected in various genres of art, music, film, and literature;",HS,113
113.41.d.24.B,"describe the impacts of cultural movements in art, music, and literature such as Tin Pan Alley, the Harlem Renaissance, the Beat Generation, rock and roll, the Chicano Mural Movement, and country and western music on American society; and",HS,113
113.41.d.24.C,identify and analyze the global diffusion of American culture through various media.,HS,113
113.41.d.25.A,"explain actions taken by people to expand economic opportunities and political rights for racial, ethnic, gender, and religious groups in American society;",HS,113
113.41.d.25.B,describe the Americanization movement to assimilate immigrants and American Indians into American culture;,HS,113
113.41.d.25.C,"explain how the contributions of people of various racial, ethnic, gender, and religious groups shape American culture; and",HS,113
113.41.d.25.D,"identify the contributions of women such as Rosa Parks, Eleanor Roosevelt, and Sonia Sotomayor to American society.",HS,113
113.41.d.26.A,"explain the effects of scientific discoveries and technological innovations such as electric power, telephone and satellite communications, petroleum-based products, steel production, and computers on the economic development of the United States;",HS,113
113.41.d.26.B,"explain how specific needs result in scientific discoveries and technological innovations in agriculture, the military, and medicine; and",HS,113
113.41.d.26.C,describe the effect of technological innovations in the workplace such as assembly line manufacturing and robotics.,HS,113
113.41.d.27.A,"analyze how scientific discoveries, technological innovations, space exploration, and the application of these by the free enterprise system improve the standard of living in the United States, including changes in transportation and communication; and",HS,113
113.41.d.27.B,"describe how the free enterprise system drives technological innovation and its application in the marketplace such as cell phones, inexpensive personal computers, and global positioning products.",HS,113
113.41.d.28.A,"analyze primary and secondary sources such as maps, graphs, speeches, political cartoons, and artifacts to acquire information to answer historical questions;",HS,113
113.41.d.28.B,"analyze information by applying absolute and relative chronology through sequencing, categorizing, identifying cause-and-effect relationships, comparing and contrasting, finding the main idea, summarizing, making generalizations, making predictions, drawing inferences, and drawing conclusions;",HS,113
113.41.d.28.C,"apply the process of historical inquiry to research, interpret, and use multiple types of sources of evidence;",HS,113
113.41.d.28.D,"evaluate a variety of historical and contemporary sources for validity, credibility, bias, and accuracy; ",HS,113
113.41.d.28.E,identify bias and support with historical evidence a point of view on a social studies issue or event; and,HS,113
113.41.d.28.F,"formulate and communicate visually, orally, or in writing a claim supported by evidence and reasoning for an intended audience and purpose.",HS,113
113.41.d.29.A,"create written, oral, and visual presentations of social studies information using effective communication skills, including proper citations and avoiding plagiarism;",HS,113
113.41.d.29.B,use social studies terminology correctly; and,HS,113
113.41.d.29.C,"apply foundational language skills to engage in civil discourse about social studies topics, including those with multiple perspectives.",HS,113
113.41.d.30.A,"create a visual representation of historical information such as thematic maps, graphs, and charts; and",HS,113
113.41.d.30.B,"pose and answer questions about geographic distributions and patterns shown on maps, graphs, charts, and available databases.",HS,113
113.41.d.31.A,"explain governmental and democratic processes such as voting, due process, and caucuses using simulations and models; and",HS,113
113.41.d.31.B,"use problem-solving and decision-making processes to identify a problem, gather information, list and consider options, consider advantages and disadvantages, choose and implement a solution, and evaluate the effectiveness of the solution.",HS,113
113.50.b.1,"1 In Ethnic Studies: Mexican American Studies, an elective course, students learn about the history and cultural contributions of Mexican Americans. Students explore history and culture from an interdisciplinary perspective. The course emphasizes events in the 20th and 21st centuries, but students will also engage with events prior to the 20th century.",HS,113
113.50.b.2,"To support the teaching of the essential knowledge and skills, the use of a variety of rich primary and secondary source material such as biographies, autobiographies, landmark cases of the U.S. Supreme Court, novels, speeches, letters, diaries, poetry, songs, and artwork is encouraged. Motivating resources are available from museums, historical sites, presidential libraries, and local and state preservation societies.",HS,113
113.50.b.3,The eight strands of the essential knowledge and skills for social studies are intended to be integrated for instructional purposes. Skills listed in the social studies skills strand in subsection (c) of this section should be incorporated into the teaching of all essential knowledge and skills for social studies. A greater depth of understanding of complex content material can be attained when integrated social studies content from the various disciplines and critical-thinking skills are taught together.,HS,113
113.50.b.4,Students identify the role of the U.S. free enterprise system within the parameters of this course and understand that this system may also be referenced as capitalism or the free market system.,HS,113
113.50.b.5,"Throughout social studies in Kindergarten-Grade 12, students build a foundation in history; geography; economics; government; citizenship; culture; science, technology, and society; and social studies skills. The content, as appropriate for the grade level or course, enables students to understand the importance of patriotism, function in a free enterprise society, and appreciate the basic democratic values of our state and nation as referenced in the Texas Education Code (TEC), §28.002(h).",HS,113
113.50.b.6,"Students understand that a constitutional republic is a representative form of government whose representatives derive their authority from the consent of the governed, serve for an established tenure, and are sworn to uphold the constitution.",HS,113
113.50.b.7,"State and federal laws mandate a variety of celebrations and observances, including Celebrate Freedom Week.",HS,113
113.50.b.8,"Students identify and discuss how the actions of U.S. citizens and the local, state, and federal governments have either met or failed to meet the ideals espoused in the founding documents.",HS,113
113.50.b.9,"Statements that contain the word ""including"" reference content that must be mastered, while those containing the phrase ""such as"" are intended as possible illustrative examples.",HS,113
113.50.b.7.A,"A Each social studies class shall include, during Celebrate Freedom Week as provided under the TEC, §29.907, or during another full school week as determined by the board of trustees of a school district, appropriate instruction concerning the intent, meaning, and importance of the Declaration of Independence and the U.S. Constitution, including the Bill of Rights, in their historical contexts. The study of the Declaration of Independence must include the study of the relationship of the ideas expressed in that document to subsequent American history, including the relationship of its ideas to the rich diversity of our people as a nation of immigrants, the American Revolution, the formulation of the U.S. Constitution, and the abolitionist movement, which led to the Emancipation Proclamation and the women's suffrage movement.",HS,113
113.50.b.7.B,"Each school district shall require that, during Celebrate Freedom Week or other week of instruction prescribed under subparagraph (A) of this paragraph, students in Grades 3-12 study and recite the following text: ""We hold these Truths to be self-evident, that all Men are created equal, that they are endowed by their Creator with certain unalienable Rights, that among these are Life, Liberty and the Pursuit of Happiness--That to secure these Rights, Governments are instituted among Men, deriving their just Powers from the Consent of the Governed."" ","03, 04, 05, 06, 07, 08, 09, 10, 11, 12",113
113.50.c.1,"113.50.c.1 History. The student understands historical points of reference in Mexican American history. The student is expected to apply absolute and relative chronology through the sequencing of significant individuals, events, and time periods.",HS,113
113.50.c.2,History. The student understands developments related to pre-colonial settlements and Spanish colonization of Mesoamerica and North America. The student is expected to:,HS,113
113.50.c.3,History. The student understands developments related to Mexican independence and Mexico's relationship with the United States from 1800-1930. The student is expected to:,HS,113
113.50.c.4,"History. The student understands the causes and impact of the Mexican American civil rights movement from the 1930s to 1975. The student is expected to:
",HS,113
113.50.c.5," History. The student understands the development of voting rights and ideas related to citizenship for Mexican Americans from 1975 to the present. The student is expected to:
",HS,113
113.50.c.6,Geography. The student understands the impact of geographic factors on major events related to Mexican Americans. The student is expected to:,HS,113
113.50.c.7,"Economics.The student understands domestic issues related to Mexican American population growth, labor force participation, and the struggle to satisfy wants and needs given scarce resources. The student is expected to:",HS,113
113.50.c.8,Government. The student understands the significance of political decisions and the struggle for Mexican American political power throughout U.S. history. The student is expected to:,HS,113
113.50.c.9,Citizenship. The student understands the debates surrounding the nature of respectful expression of different points of view in a constitutional republic. The student is expected to:,HS,113
113.50.c.10,Culture. The student understands the relationship between Mexican American artistic expression and the times during which the art was created. The student is expected to:,HS,113
113.50.c.11,"Science, technology, and society. The student understands the impact of Mexican American individuals and groups on the development of science and technology in American society and on a global scale. The student is expected to:",HS,113
113.50.c.12,"Social studies skills. The student applies critical-thinking skills to organize and use information acquired from a variety of valid sources, including electronic technology. The student is expected to:",HS,113
113.50.c.2.A,"explain the significance of the following events as turning points relevant to Mexican American history: Aztec arrival in Mexico's central valley, establishment of the Aztec Empire, Hernán Cortés's first encounter with the Aztecs, Spanish conquest of the Aztecs, creation of the New Laws, and Jesuit expulsion from the Americas; and",HS,113
113.50.c.2.B,"examine the contributions of significant individuals from the Spanish colonial era, including Moctezuma, Hernán Cortés, La Malinche, Bartolomé de las Casas, and Sor Juana Inés de la Cruz. ",HS,113
113.50.c.3.A,"explain the significance of the following events as turning points relevant to Mexican American history: the Grito de Dolores, Mexico's acquisition of independence, Texas's declaration of independence from Mexico, Mexican-American War, Treaty of Guadalupe Hidalgo, Mexican Revolution, creation of the U.S. Border Patrol, and Mexican repatriation of the 1930s; and",HS,113
113.50.c.3.B," examine the contributions of significant individuals from this period such as Father Miguel Hidalgo, José María Morelos, Augustín de Iturbide, Emiliano Zapata, Francisco (Pancho) Villa, Francisco I. Madero, Porfirio Díaz, and Álvaro Obregón.",HS,113
113.50.c.4.A,"explain the significance of the following events as turning points relevant to Mexican American history: U.S. entry into World War II, Bracero Program, Longoria Affair, Operation Wetback, Hernández v. Texas, Brown v. Board of Education, Civil Rights Act of 1964, Voting Rights Act of 1965, Farmworkers strike and boycott, and establishment of La Raza Unida Party; and",HS,113
113.50.c.4.B,"identify the contributions of significant individuals from the civil rights era such as César Chávez, Dolores Huerta, Reies López Tijerina, José Ángel Gutiérrez, Rubén Salazar, Emma Tenayuca, Rodolfo ""Corky"" Gonzales, Marcario García, Hector P. García, Raul ""Roy"" Perez Benavidez, Martha P. Cotera, Jovita Idár, Jovita González de Mireles, Sara Estela Ramírez, Leonor Villegas de Magnon, Adela Sloss Vento, María L. de Hernández, and Alicia ""Alice"" Dickerson Montemayor.",HS,113
113.50.c.5.A,"explain the significance of the following events as turning points relevant to Mexican American history: the Immigration Reform and Control Act, Illegal Immigration Reform and Immigration Responsibility Act; and H.R. 4437 passed by the U.S. House of Representatives in 2006; and",HS,113
113.50.c.5.B,"identify the contributions of significant individuals such as Raul Yzaguirre, William ""Willie"" Velásquez, Gloria Evangelina Anzaldúa, Henry Cisneros, Cherríe L. Moraga, and Bill Richardson",HS,113
113.50.c.6.A,locate places and regions of cultural and historical significance in Mexican American history;,HS,113
113.50.c.6.B,identify physical and human geographic factors related to the settlement of American Indian societies;,HS,113
113.50.c.6.C,"explain how issues of land use related to Mexican Independence, Texas Independence, and the Mexican Revolution;",HS,113
113.50.c.6.D,analyze physical and human geographic factors related to Mexican migration from the 1910s to the 1930s;,HS,113
113.50.c.6.E," identify physical and human geographic factors related to the migration of Mexican laborers as part of the 1940s Bracero Program; and
",HS,113
113.50.c.6.F,analyze the physical and human geographic factors related to contemporary Mexican migration to and Mexican American migration within the United States.,HS,113
113.50.c.8.A,describe how Mexican Americans have participated in supporting and changing government;,HS,113
113.50.c.8.B,"analyze the impact of Salvatierra v. Del Rio Independent School District (ISD), Delgado v. Bastrop ISD, and Hernández v. Texas on Mexican Americans and the end of the biracial paradigm;",HS,113
113.50.c.8.C,analyze the Mexican American struggle for civil rights as manifested in the Chicano movement;,no workie,113
113.50.c.8.D,evaluate the successes and failures of the Mexican American civil rights movement and the farmworkers movement;,HS,113
113.50.c.8.E,"analyze the significance of U.S. Supreme Court decisions in Miranda v. Arizona, San Antonio ISD v. Rodríguez, and Plyler v. Doe; and",HS,113
113.50.c.8.F,"discuss the role of various organizations such as the American G.I. Forum, the League of United Latin American Citizens (LULAC), the Mexican American Legal Defense and Educational Fund (MALDEF), the National Association of Latino Elected and Appointed Officials (NALEO), and the National Council of La Raza (NCLR) that have participated in the Mexican American struggle for political power.",HS,113
113.50.c.9.A,describe the rights and responsibilities of Mexican American citizens and Mexican immigrants in civic participation within the United States;,HS,113
113.50.c.9.B,"discuss ways American citizens and immigrants interpret formal citizenship and cultural citizenship, including membership in one nation and membership in diverse cultural and national groups;",HS,113
113.50.c.9.C,discuss ways individuals contribute to the national identity as members of diverse cultural groups; and,HS,113
113.50.c.9.D,"analyze the connotations and histories of identity nomenclature relevant to Mexican Americans such as Mexican, Spanish, Hispanic, Latina/o, Chicana/o, illegal, undocumented, Mexican American, American Mexican, or simply American.",HS,113
113.50.c.10.A,"describe how the characteristics and issues of Mexican American history have been reflected in various genres of art, music, film, and literature;",HS,113
113.50.c.10.B,"analyze the significance of selected works of Mexican American literature such as ""I am Joaquín"" (1967) by Rodolfo ""Corky"" Gonzales and ""Pensamiento Serpentino"" (1971) by Luis Valdez;",HS,113
113.50.c.10.C,"describe the role of artistic expression in mobilizing Mexican Americans and others toward civic participation and action such as the role of ""Teatro Campesino"" during the farmworkers movement;",HS,113
113.50.c.10.D,identify the contributions of women such as Sandra Cisneros and Norma Alarcón; and,HS,113
113.50.c.10.E,identify the impact of Mexican American popular culture on the United States and the world over time.,HS,113
113.50.c.11.A,"explain the major ideas in astronomy, mathematics, and architectural engineering that developed in the Maya and Aztec civilizations; and",HS,113
113.50.c.11.B,"identify contributions to science and technology in the United States and the world made by Mexican Americans such as Albert Baez, Martha E. Bernal, Ellen Ochoa, Linda Garcia Cubero, and Mario José Molina.",HS,113
113.50.c.12.A,use social studies terminology correctly;,HS,113
113.50.c.12.B,analyze diverse points of view related to contemporary Mexican American issues;,HS,113
113.50.c.12.C,create a written and/or oral presentation on a contemporary issue or topic relevant to Mexican Americans using critical methods of inquiry; and,HS,113
113.50.c.12.D,"analyze information by sequencing, categorizing, identifying cause-and-effect relationships, comparing, contrasting, finding the main idea, summarizing, making generalizations and predictions, and drawing inferences and conclusions.",HS,113
113.31.d,113.31.d Knowledge and skills.,HS,113
113.31.c.3,113.31.c.3 Economics with Emphasis on the Free Enterprise System and Its Benefits builds upon the foundation in economics and social studies laid by the social studies essential knowledge and skills in Kindergarten-Grade 12. The course will apply these sk,HS,113
113.31.c.4,"113.31.c.4 Students understand that a constitutional republic is a representative form of government whose representatives derive their authority from the consent of the governed, serve for an established tenure, and are sworn to uphold the constitution.",HS,113
113.31.c.5,"113.31.c.5 As referenced in House Bill 492, an act of the Texas Legislature signed into law in 2005, the concepts of personal financial literacy are to be mastered by students in order that they may become self-supporting adults who can make informed decisions.",HS,113
113.31.c.6,"113.31.c.6 State and federal laws mandate a variety of celebrations and observances, including Celebrate Freedom Week.",HS,113
113.31.c.7,"113.31.c.7 Students discuss how and whether the actions of U.S. citizens and the local, state, and federal governments have achieved the ideals espoused in the founding documents.",HS,113
113.31.c.6.A,"Each social studies class shall include, during Celebrate Freedom Week as provided under the TEC, §29.907, or during another full school week as determined by the board of trustees of a school district, appropriate instruction concerning the",no workie,113
113.31.c.6.B,"Each school district shall require that, during Celebrate Freedom Week or other week of instruction prescribed under subparagraph (A) of this paragraph, students in Grades 3-12 study and recite the following text from the Declaration of Indep",no workie,113
113.31.d.1,113.31.d.1 Economics. The student understands the concepts of scarcity and opportunity costs. The student is expected to:,HS,113
113.31.d.2,"113.31.d.2 Economics. The student understands the interaction of supply, demand, and price. The student is expected to:",HS,113
113.31.d.3,113.31.d.3 Economics. The student understands the reasons for international trade and its importance to the United States and the global economy. The student is expected to: Economics. The student understands the reasons for international trade and its importance to the United States and the global economy. The student is expected to:,HS,113
113.31.d.4,"113.31.d.4 Economics. The student understands free enterprise, socialist, and communist economic systems. The student is expected to:",HS,113
113.31.d.5,113.31.d.5 Economics. The student understands the basic characteristics and benefits of the U.S. free enterprise system. The student is expected to:,HS,113
113.31.d.6,"113.31.d.6 Economics. The student understands the right to own, use, and dispose of private property. The student is expected to:",HS,113
113.31.d.7,113.31.d.7 Economics. The student understands the circular-flow model of the economy. The student is expected to:,HS,113
113.31.d.8,113.31.d.8 Economics. The student understands types of market structures. The student is expected to:,HS,113
113.31.d.9,113.31.d.9 Economics. The student understands key economic measurements. The student is expected to:,HS,113
113.31.d.10,113.31.d.10 Economics. The student understands key components of economic growth. The student is expected to:,HS,113
113.31.d.11,113.31.d.11 Economics. The student understands the role of money in an economy. The student is expected to:,HS,113
113.31.d.12,113.31.d.12 Economics. The student understands the role of the Federal Reserve System in establishing monetary policy. The student is expected to:,HS,113
113.31.d.13,113.31.d.13 Economics. The student understands the role that the government plays in the U.S. free enterprise system. The student is expected to:,HS,113
113.31.d.14,"113.31.d.14 Economics. The student understands the economic impact of fiscal policy decisions at the local, state, and national levels. The student is expected to:",HS,113
